### ISSUE TITLE
MacOS DNS resolve time out.

### ISSUE THREAD

**Issue by GuangTianLi** [grpc/grpc#20216]
### What version of gRPC and what language are you using?

Python - grpcio==1.23.0

### What operating system (Linux, Windows,...) and version?

MacOS Mojave 10.14.6

### What runtime / compiler are you using (e.g. python version or version of gcc)

Python 3.7.3

### What did you do?
If possible, provide a recipe for reproducing the error. Try being specific and include code snippets if helpful.

When I use domain in channel target rather than ip, the c-ares resolver will fail due to timeout.

### What did you expect to see?

The timeout should not exist.

### What did you see instead?

According to debug information of MacOS, I found the single difference to cause timeout compare to the linux which did not happen.

MacOS debug info:

    grpc_completion_queue_next(cq=0x7fad52f10850, deadline=gpr_timespec { tv_sec: 1568101036, tv_nsec: 56266000, clock_type: 1 }, reserved=0x0)

Linux debug info:

    grpc_completion_queue_next(cq=0x55b82fdfd340, deadline=gpr_timespec { tv_sec: 1568102014, tv_nsec: 439634292, clock_type: 1 }, reserved=(nil))

Make sure you include information that can help us debug (full error message, exception listing, stack trace, logs).

See [TROUBLESHOOTING.md](https://github.com/grpc/grpc/blob/master/TROUBLESHOOTING.md) for how to diagnose problems better.

**Comment by lidizheng** [comment]
@GuangTianLi What type of DNS record are you using? Our current support for SRV records is meant for `grpclb`, and doesn't necessarily work for all scenarios.

+@apolcyn Does C-Ares requires some special changes to make name resolution work? Like adding `dns://` prefix?

**Comment by apolcyn** [comment]
If you use an ip, then DNS resolution will bypass and the IP will be directly parsed and used. If a name is used, DNS resolution will be invoked. A timeout for DNS resolution is certainly strange though. Suggest a couple of things to gather more debug info:

1) Does "dig A/AAAA <your DNS name>" work from your same machine?
2) Can you run your process under these environment variables, and paste the log output from stderr:
  * GRPC_VERBOSITY=DEBUG
  * GRPC_TRACE=api,client_channel_routing,cares_resolver,cares_address_sorting

**Comment by GuangTianLi** [comment]
> If you use an ip, then DNS resolution will bypass and the IP will be directly parsed and used. If a name is used, DNS resolution will be invoked. A timeout for DNS resolution is certainly strange though. Suggest a couple of things to gather more debug info:
> 
> 1. Does "dig A/AAAA " work from your same machine?
> 2. Can you run your process under these environment variables, and paste the log output from stderr:
> 
> * GRPC_VERBOSITY=DEBUG
> * GRPC_TRACE=api,client_channel_routing,cares_resolver,cares_address_sorting

```text
I0910 15:37:10.224596000 4638729664 init.cc:163]                       grpc_init(void)
I0910 15:37:10.224619000 4638729664 completion_queue.cc:504]           grpc_completion_queue_create_internal(completion_type=0, polling_type=0)
I0910 15:37:10.224626000 4638729664 completion_queue.cc:504]           grpc_completion_queue_create_internal(completion_type=0, polling_type=0)
I0910 15:37:10.224642000 4638729664 channel_create.cc:94]              grpc_insecure_channel_create(target=ai-school.grpc-service.gllue.net:50051, args=0x10efde180, reserved=0x0)
I0910 15:37:10.224664000 4638729664 init.cc:163]                       grpc_init(void)
I0910 15:37:10.225754000 4638729664 completion_queue.cc:504]           grpc_completion_queue_create_internal(completion_type=0, polling_type=0)
I0910 15:37:10.226057000 4638729664 metadata_array.cc:29]              grpc_metadata_array_init(array=0x10efdaa98)
I0910 15:37:10.226064000 4638729664 metadata_array.cc:29]              grpc_metadata_array_init(array=0x10ec19a18)
I0910 15:37:10.226102000 4638729664 call.cc:1927]                      grpc_call_start_batch(call=0x7fad53895a60, ops=0x7fad52dab290, nops=6, tag=0x10efde150, reserved=0x0)
I0910 15:37:10.226110000 4638729664 call.cc:1526]                      ops[0]: SEND_INITIAL_METADATA(nil)
I0910 15:37:10.226114000 4638729664 call.cc:1526]                      ops[1]: SEND_MESSAGE ptr=0x7fad52da6ee0
I0910 15:37:10.226117000 4638729664 call.cc:1526]                      ops[2]: SEND_CLOSE_FROM_CLIENT
I0910 15:37:10.226121000 4638729664 call.cc:1526]                      ops[3]: RECV_INITIAL_METADATA ptr=0x10efdaa98
I0910 15:37:10.226125000 4638729664 call.cc:1526]                      ops[4]: RECV_MESSAGE ptr=0x10efa19a0
I0910 15:37:10.226130000 4638729664 call.cc:1526]                      ops[5]: RECV_STATUS_ON_CLIENT metadata=0x10ec19a18 status=0x10ec19a30 details=0x10ec19a38
D0910 15:37:10.226294000 4638729664 dns_resolver_ares.cc:176]          (c-ares resolver) resolver:0x7fad52e2e530 AresDnsResolver::StartLocked() is called.
D0910 15:37:10.226308000 4638729664 grpc_ares_wrapper.cc:605]          (c-ares resolver) request:0x7fad52e01e20 c-ares grpc_dns_lookup_ares_locked_impl name=ai-school.grpc-service.gllue.net:50051, default_port=https
D0910 15:37:10.227475000 4638729664 grpc_ares_ev_driver.cc:155]        (c-ares resolver) request:0x7fad52e01e20 grpc_ares_ev_driver_create_locked
D0910 15:37:10.227485000 4638729664 grpc_ares_wrapper.cc:160]          (c-ares resolver) request:0x7fad52e01e20 create_hostbyname_request_locked host:ai-school.grpc-service.gllue.net port:33731 is_balancer:0
D0910 15:37:10.227595000 4638729664 grpc_ares_wrapper.cc:160]          (c-ares resolver) request:0x7fad52e01e20 create_hostbyname_request_locked host:ai-school.grpc-service.gllue.net port:33731 is_balancer:0
D0910 15:37:10.227630000 4638729664 grpc_ares_wrapper.cc:186]          (c-ares resolver) request:0x7fad52e01e20 on_hostbyname_done_locked host=ai-school.grpc-service.gllue.net ARES_SUCCESS
D0910 15:37:10.227637000 4638729664 grpc_ares_wrapper.cc:233]          (c-ares resolver) request:0x7fad52e01e20 c-ares resolver gets a AF_INET result:
  addr: 127.0.0.1
  port: 50051

D0910 15:37:10.227644000 4638729664 grpc_ares_ev_driver.cc:363]        (c-ares resolver) request:0x7fad52e01e20 new fd: c-ares fd: 9
D0910 15:37:10.227648000 4638729664 grpc_ares_ev_driver.cc:98]         (c-ares resolver) request:0x7fad52e01e20 Ref ev_driver 0x7fad52e1e940
D0910 15:37:10.227657000 4638729664 grpc_ares_ev_driver.cc:382]        (c-ares resolver) request:0x7fad52e01e20 notify read on: c-ares fd: 9
D0910 15:37:10.227662000 4638729664 grpc_ares_ev_driver.cc:436]        (c-ares resolver) request:0x7fad52e01e20 ev_driver=0x7fad52e1e940 grpc_ares_ev_driver_start_locked. timeout in 120010 ms
D0910 15:37:10.227665000 4638729664 grpc_ares_ev_driver.cc:98]         (c-ares resolver) request:0x7fad52e01e20 Ref ev_driver 0x7fad52e1e940
D0910 15:37:10.227670000 4638729664 grpc_ares_ev_driver.cc:233]        (c-ares resolver) request:0x7fad52e01e20 ev_driver=0x7fad52e1e940. next ares process poll time in 1000 ms
D0910 15:37:10.227673000 4638729664 grpc_ares_ev_driver.cc:98]         (c-ares resolver) request:0x7fad52e01e20 Ref ev_driver 0x7fad52e1e940
D0910 15:37:10.227677000 4638729664 dns_resolver_ares.cc:427]          (c-ares resolver) resolver:0x7fad52e2e530 Started resolving. pending_request_:0x7fad52e01e20
I0910 15:37:10.227728000 4638729664 completion_queue.cc:966]           grpc_completion_queue_next(cq=0x7fad52dab120, deadline=gpr_timespec { tv_sec: 1568101030, tv_nsec: 427726000, clock_type: 1 }, reserved=0x0)
D0910 15:37:10.280315000 4638729664 grpc_ares_ev_driver.cc:298]        (c-ares resolver) request:0x7fad52e01e20 readable on c-ares fd: 9
D0910 15:37:10.280411000 4638729664 grpc_ares_ev_driver.cc:98]         (c-ares resolver) request:0x7fad52e01e20 Ref ev_driver 0x7fad52e1e940
D0910 15:37:10.280424000 4638729664 grpc_ares_ev_driver.cc:382]        (c-ares resolver) request:0x7fad52e01e20 notify read on: c-ares fd: 9
D0910 15:37:10.280434000 4638729664 grpc_ares_ev_driver.cc:105]        (c-ares resolver) request:0x7fad52e01e20 Unref ev_driver 0x7fad52e1e940
I0910 15:37:10.423226000 123145351360512 completion_queue.cc:966]      grpc_completion_queue_next(cq=0x7fad52f10850, deadline=gpr_timespec { tv_sec: 1568101030, tv_nsec: 623218000, clock_type: 1 }, reserved=0x0)
I0910 15:37:10.430562000 4638729664 completion_queue.cc:966]           grpc_completion_queue_next(cq=0x7fad52dab120, deadline=gpr_timespec { tv_sec: 1568101030, tv_nsec: 630554000, clock_type: 1 }, reserved=0x0)
I0910 15:37:10.624934000 123145351360512 completion_queue.cc:966]      grpc_completion_queue_next(cq=0x7fad52f10850, deadline=gpr_timespec { tv_sec: 1568101030, tv_nsec: 824922000, clock_type: 1 }, reserved=0x0)
I0910 15:37:10.635832000 4638729664 completion_queue.cc:966]           grpc_completion_queue_next(cq=0x7fad52dab120, deadline=gpr_timespec { tv_sec: 1568101030, tv_nsec: 835801000, clock_type: 1 }, reserved=0x0)
I0910 15:37:10.828796000 123145351360512 completion_queue.cc:966]      grpc_completion_queue_next(cq=0x7fad52f10850, deadline=gpr_timespec { tv_sec: 1568101031, tv_nsec: 28783000, clock_type: 1 }, reserved=0x0)
I0910 15:37:10.840378000 4638729664 completion_queue.cc:966]           grpc_completion_queue_next(cq=0x7fad52dab120, deadline=gpr_timespec { tv_sec: 1568101031, tv_nsec: 40371000, clock_type: 1 }, reserved=0x0)
I0910 15:37:11.031356000 123145351360512 completion_queue.cc:966]      grpc_completion_queue_next(cq=0x7fad52f10850, deadline=gpr_timespec { tv_sec: 1568101031, tv_nsec: 222971904, clock_type: 1 }, reserved=0x0)
I0910 15:37:11.041576000 4638729664 completion_queue.cc:966]           grpc_completion_queue_next(cq=0x7fad52dab120, deadline=gpr_timespec { tv_sec: 1568101031, tv_nsec: 241557000, clock_type: 1 }, reserved=0x0)
I0910 15:37:11.226062000 123145351360512 completion_queue.cc:966]      grpc_completion_queue_next(cq=0x7fad52f10850, deadline=gpr_timespec { tv_sec: 1568101031, tv_nsec: 426045000, clock_type: 1 }, reserved=0x0)
D0910 15:37:11.226146000 123145346105344 grpc_ares_ev_driver.cc:264]   (c-ares resolver) request:0x7fad52e01e20 ev_driver=0x7fad52e1e940 on_ares_backup_poll_alarm_locked. driver->shutting_down=0. err="No Error"
D0910 15:37:11.226182000 123145346105344 grpc_ares_ev_driver.cc:272]   (c-ares resolver) request:0x7fad52e01e20 ev_driver=0x7fad52e1e940 on_ares_backup_poll_alarm_locked; ares_process_fd. fd=c-ares fd: 9
D0910 15:37:11.226206000 123145346105344 grpc_ares_ev_driver.cc:233]   (c-ares resolver) request:0x7fad52e01e20 ev_driver=0x7fad52e1e940. next ares process poll time in 1000 ms
D0910 15:37:11.226216000 123145346105344 grpc_ares_ev_driver.cc:98]    (c-ares resolver) request:0x7fad52e01e20 Ref ev_driver 0x7fad52e1e940
D0910 15:37:11.226227000 123145346105344 grpc_ares_ev_driver.cc:105]   (c-ares resolver) request:0x7fad52e01e20 Unref ev_driver 0x7fad52e1e940
I0910 15:37:11.245860000 4638729664 completion_queue.cc:966]           grpc_completion_queue_next(cq=0x7fad52dab120, deadline=gpr_timespec { tv_sec: 1568101031, tv_nsec: 445844000, clock_type: 1 }, reserved=0x0)
I0910 15:37:11.432180000 123145351360512 completion_queue.cc:966]      grpc_completion_queue_next(cq=0x7fad52f10850, deadline=gpr_timespec { tv_sec: 1568101031, tv_nsec: 632166000, clock_type: 1 }, reserved=0x0)
I0910 15:37:11.447413000 4638729664 completion_queue.cc:966]           grpc_completion_queue_next(cq=0x7fad52dab120, deadline=gpr_timespec { tv_sec: 1568101031, tv_nsec: 647210000, clock_type: 1 }, reserved=0x0)
I0910 15:37:11.635713000 123145351360512 completion_queue.cc:966]      grpc_completion_queue_next(cq=0x7fad52f10850, deadline=gpr_timespec { tv_sec: 1568101031, tv_nsec: 835704000, clock_type: 1 }, reserved=0x0)
I0910 15:37:11.648818000 4638729664 completion_queue.cc:966]           grpc_completion_queue_next(cq=0x7fad52dab120, deadline=gpr_timespec { tv_sec: 1568101031, tv_nsec: 848812000, clock_type: 1 }, reserved=0x0)
I0910 15:37:11.841122000 123145351360512 completion_queue.cc:966]      grpc_completion_queue_next(cq=0x7fad52f10850, deadline=gpr_timespec { tv_sec: 1568101032, tv_nsec: 41110000, clock_type: 1 }, reserved=0x0)
I0910 15:37:11.854400000 4638729664 completion_queue.cc:966]           grpc_completion_queue_next(cq=0x7fad52dab120, deadline=gpr_timespec { tv_sec: 1568101032, tv_nsec: 54392000, clock_type: 1 }, reserved=0x0)
I0910 15:37:12.045817000 123145351360512 completion_queue.cc:966]      grpc_completion_queue_next(cq=0x7fad52f10850, deadline=gpr_timespec { tv_sec: 1568101032, tv_nsec: 226036992, clock_type: 1 }, reserved=0x0)
I0910 15:37:12.057933000 4638729664 completion_queue.cc:966]           grpc_completion_queue_next(cq=0x7fad52dab120, deadline=gpr_timespec { tv_sec: 1568101032, tv_nsec: 257923000, clock_type: 1 }, reserved=0x0)
D0910 15:37:12.226778000 123145351897088 grpc_ares_ev_driver.cc:264]   (c-ares resolver) request:0x7fad52e01e20 ev_driver=0x7fad52e1e940 on_ares_backup_poll_alarm_locked. driver->shutting_down=0. err="No Error"
D0910 15:37:12.226817000 123145351897088 grpc_ares_ev_driver.cc:272]   (c-ares resolver) request:0x7fad52e01e20 ev_driver=0x7fad52e1e940 on_ares_backup_poll_alarm_locked; ares_process_fd. fd=c-ares fd: 9
D0910 15:37:12.226833000 123145351897088 grpc_ares_ev_driver.cc:233]   (c-ares resolver) request:0x7fad52e01e20 ev_driver=0x7fad52e1e940. next ares process poll time in 1000 ms
D0910 15:37:12.226840000 123145351897088 grpc_ares_ev_driver.cc:98]    (c-ares resolver) request:0x7fad52e01e20 Ref ev_driver 0x7fad52e1e940
D0910 15:37:12.226847000 123145351897088 grpc_ares_ev_driver.cc:105]   (c-ares resolver) request:0x7fad52e01e20 Unref ev_driver 0x7fad52e1e940
I0910 15:37:12.230712000 123145351360512 completion_queue.cc:966]      grpc_completion_queue_next(cq=0x7fad52f10850, deadline=gpr_timespec { tv_sec: 1568101032, tv_nsec: 430696000, clock_type: 1 }, reserved=0x0)
I0910 15:37:12.262616000 4638729664 completion_queue.cc:966]           grpc_completion_queue_next(cq=0x7fad52dab120, deadline=gpr_timespec { tv_sec: 1568101032, tv_nsec: 462606000, clock_type: 1 }, reserved=0x0)
I0910 15:37:12.435846000 123145351360512 completion_queue.cc:966]      grpc_completion_queue_next(cq=0x7fad52f10850, deadline=gpr_timespec { tv_sec: 1568101032, tv_nsec: 635830000, clock_type: 1 }, reserved=0x0)
I0910 15:37:12.468833000 4638729664 completion_queue.cc:966]           grpc_completion_queue_next(cq=0x7fad52dab120, deadline=gpr_timespec { tv_sec: 1568101032, tv_nsec: 668813000, clock_type: 1 }, reserved=0x0)
I0910 15:37:12.640223000 123145351360512 completion_queue.cc:966]      grpc_completion_queue_next(cq=0x7fad52f10850, deadline=gpr_timespec { tv_sec: 1568101032, tv_nsec: 840210000, clock_type: 1 }, reserved=0x0)
I0910 15:37:12.673936000 4638729664 completion_queue.cc:966]           grpc_completion_queue_next(cq=0x7fad52dab120, deadline=gpr_timespec { tv_sec: 1568101032, tv_nsec: 873919000, clock_type: 1 }, reserved=0x0)
I0910 15:37:12.844662000 123145351360512 completion_queue.cc:966]      grpc_completion_queue_next(cq=0x7fad52f10850, deadline=gpr_timespec { tv_sec: 1568101033, tv_nsec: 44649000, clock_type: 1 }, reserved=0x0)
I0910 15:37:12.876728000 4638729664 completion_queue.cc:966]           grpc_completion_queue_next(cq=0x7fad52dab120, deadline=gpr_timespec { tv_sec: 1568101033, tv_nsec: 76720000, clock_type: 1 }, reserved=0x0)
I0910 15:37:13.049755000 123145351360512 completion_queue.cc:966]      grpc_completion_queue_next(cq=0x7fad52f10850, deadline=gpr_timespec { tv_sec: 1568101033, tv_nsec: 230688000, clock_type: 1 }, reserved=0x0)
I0910 15:37:13.079428000 4638729664 completion_queue.cc:966]           grpc_completion_queue_next(cq=0x7fad52dab120, deadline=gpr_timespec { tv_sec: 1568101033, tv_nsec: 279421000, clock_type: 1 }, reserved=0x0)
D0910 15:37:13.229046000 123145346105344 grpc_ares_ev_driver.cc:264]   (c-ares resolver) request:0x7fad52e01e20 ev_driver=0x7fad52e1e940 on_ares_backup_poll_alarm_locked. driver->shutting_down=0. err="No Error"
D0910 15:37:13.229088000 123145346105344 grpc_ares_ev_driver.cc:272]   (c-ares resolver) request:0x7fad52e01e20 ev_driver=0x7fad52e1e940 on_ares_backup_poll_alarm_locked; ares_process_fd. fd=c-ares fd: 9
D0910 15:37:13.229118000 123145346105344 grpc_ares_ev_driver.cc:233]   (c-ares resolver) request:0x7fad52e01e20 ev_driver=0x7fad52e1e940. next ares process poll time in 1000 ms
D0910 15:37:13.229134000 123145346105344 grpc_ares_ev_driver.cc:98]    (c-ares resolver) request:0x7fad52e01e20 Ref ev_driver 0x7fad52e1e940
D0910 15:37:13.229154000 123145346105344 grpc_ares_ev_driver.cc:105]   (c-ares resolver) request:0x7fad52e01e20 Unref ev_driver 0x7fad52e1e940
I0910 15:37:13.235926000 123145351360512 completion_queue.cc:966]      grpc_completion_queue_next(cq=0x7fad52f10850, deadline=gpr_timespec { tv_sec: 1568101033, tv_nsec: 435909000, clock_type: 1 }, reserved=0x0)
I0910 15:37:13.280597000 4638729664 completion_queue.cc:966]           grpc_completion_queue_next(cq=0x7fad52dab120, deadline=gpr_timespec { tv_sec: 1568101033, tv_nsec: 480584000, clock_type: 1 }, reserved=0x0)
I0910 15:37:13.439328000 123145351360512 completion_queue.cc:966]      grpc_completion_queue_next(cq=0x7fad52f10850, deadline=gpr_timespec { tv_sec: 1568101033, tv_nsec: 639320000, clock_type: 1 }, reserved=0x0)
I0910 15:37:13.485766000 4638729664 completion_queue.cc:966]           grpc_completion_queue_next(cq=0x7fad52dab120, deadline=gpr_timespec { tv_sec: 1568101033, tv_nsec: 685757000, clock_type: 1 }, reserved=0x0)
I0910 15:37:13.642442000 123145351360512 completion_queue.cc:966]      grpc_completion_queue_next(cq=0x7fad52f10850, deadline=gpr_timespec { tv_sec: 1568101033, tv_nsec: 842423000, clock_type: 1 }, reserved=0x0)
I0910 15:37:13.691899000 4638729664 completion_queue.cc:966]           grpc_completion_queue_next(cq=0x7fad52dab120, deadline=gpr_timespec { tv_sec: 1568101033, tv_nsec: 891883000, clock_type: 1 }, reserved=0x0)
I0910 15:37:13.844217000 123145351360512 completion_queue.cc:966]      grpc_completion_queue_next(cq=0x7fad52f10850, deadline=gpr_timespec { tv_sec: 1568101034, tv_nsec: 44210000, clock_type: 1 }, reserved=0x0)
I0910 15:37:13.895309000 4638729664 completion_queue.cc:966]           grpc_completion_queue_next(cq=0x7fad52dab120, deadline=gpr_timespec { tv_sec: 1568101034, tv_nsec: 95302000, clock_type: 1 }, reserved=0x0)
I0910 15:37:14.047389000 123145351360512 completion_queue.cc:966]      grpc_completion_queue_next(cq=0x7fad52f10850, deadline=gpr_timespec { tv_sec: 1568101034, tv_nsec: 235902976, clock_type: 1 }, reserved=0x0)
I0910 15:37:14.099276000 4638729664 completion_queue.cc:966]           grpc_completion_queue_next(cq=0x7fad52dab120, deadline=gpr_timespec { tv_sec: 1568101034, tv_nsec: 299266000, clock_type: 1 }, reserved=0x0)
D0910 15:37:14.229600000 123145351897088 grpc_ares_ev_driver.cc:264]   (c-ares resolver) request:0x7fad52e01e20 ev_driver=0x7fad52e1e940 on_ares_backup_poll_alarm_locked. driver->shutting_down=0. err="No Error"
D0910 15:37:14.229629000 123145351897088 grpc_ares_ev_driver.cc:272]   (c-ares resolver) request:0x7fad52e01e20 ev_driver=0x7fad52e1e940 on_ares_backup_poll_alarm_locked; ares_process_fd. fd=c-ares fd: 9
D0910 15:37:14.229654000 123145351897088 grpc_ares_ev_driver.cc:233]   (c-ares resolver) request:0x7fad52e01e20 ev_driver=0x7fad52e1e940. next ares process poll time in 1000 ms
D0910 15:37:14.229665000 123145351897088 grpc_ares_ev_driver.cc:98]    (c-ares resolver) request:0x7fad52e01e20 Ref ev_driver 0x7fad52e1e940
D0910 15:37:14.229675000 123145351897088 grpc_ares_ev_driver.cc:105]   (c-ares resolver) request:0x7fad52e01e20 Unref ev_driver 0x7fad52e1e940
I0910 15:37:14.237635000 123145351360512 completion_queue.cc:966]      grpc_completion_queue_next(cq=0x7fad52f10850, deadline=gpr_timespec { tv_sec: 1568101034, tv_nsec: 437624000, clock_type: 1 }, reserved=0x0)
I0910 15:37:14.300388000 4638729664 completion_queue.cc:966]           grpc_completion_queue_next(cq=0x7fad52dab120, deadline=gpr_timespec { tv_sec: 1568101034, tv_nsec: 500380000, clock_type: 1 }, reserved=0x0)
I0910 15:37:14.441640000 123145351360512 completion_queue.cc:966]      grpc_completion_queue_next(cq=0x7fad52f10850, deadline=gpr_timespec { tv_sec: 1568101034, tv_nsec: 641624000, clock_type: 1 }, reserved=0x0)
I0910 15:37:14.504449000 4638729664 completion_queue.cc:966]           grpc_completion_queue_next(cq=0x7fad52dab120, deadline=gpr_timespec { tv_sec: 1568101034, tv_nsec: 704433000, clock_type: 1 }, reserved=0x0)
I0910 15:37:14.642874000 123145351360512 completion_queue.cc:966]      grpc_completion_queue_next(cq=0x7fad52f10850, deadline=gpr_timespec { tv_sec: 1568101034, tv_nsec: 842862000, clock_type: 1 }, reserved=0x0)
I0910 15:37:14.708997000 4638729664 completion_queue.cc:966]           grpc_completion_queue_next(cq=0x7fad52dab120, deadline=gpr_timespec { tv_sec: 1568101034, tv_nsec: 908983000, clock_type: 1 }, reserved=0x0)
I0910 15:37:14.847581000 123145351360512 completion_queue.cc:966]      grpc_completion_queue_next(cq=0x7fad52f10850, deadline=gpr_timespec { tv_sec: 1568101035, tv_nsec: 47535000, clock_type: 1 }, reserved=0x0)
I0910 15:37:14.915144000 4638729664 completion_queue.cc:966]           grpc_completion_queue_next(cq=0x7fad52dab120, deadline=gpr_timespec { tv_sec: 1568101035, tv_nsec: 115137000, clock_type: 1 }, reserved=0x0)
I0910 15:37:15.049380000 123145351360512 completion_queue.cc:966]      grpc_completion_queue_next(cq=0x7fad52f10850, deadline=gpr_timespec { tv_sec: 1568101035, tv_nsec: 237616128, clock_type: 1 }, reserved=0x0)
I0910 15:37:15.118266000 4638729664 completion_queue.cc:966]           grpc_completion_queue_next(cq=0x7fad52dab120, deadline=gpr_timespec { tv_sec: 1568101035, tv_nsec: 318254000, clock_type: 1 }, reserved=0x0)
D0910 15:37:15.229463000 123145346105344 grpc_ares_ev_driver.cc:264]   (c-ares resolver) request:0x7fad52e01e20 ev_driver=0x7fad52e1e940 on_ares_backup_poll_alarm_locked. driver->shutting_down=0. err="No Error"
D0910 15:37:15.229506000 123145346105344 grpc_ares_ev_driver.cc:272]   (c-ares resolver) request:0x7fad52e01e20 ev_driver=0x7fad52e1e940 on_ares_backup_poll_alarm_locked; ares_process_fd. fd=c-ares fd: 9
D0910 15:37:15.229540000 123145346105344 grpc_ares_ev_driver.cc:233]   (c-ares resolver) request:0x7fad52e01e20 ev_driver=0x7fad52e1e940. next ares process poll time in 1000 ms
D0910 15:37:15.229557000 123145346105344 grpc_ares_ev_driver.cc:98]    (c-ares resolver) request:0x7fad52e01e20 Ref ev_driver 0x7fad52e1e940
D0910 15:37:15.229576000 123145346105344 grpc_ares_ev_driver.cc:105]   (c-ares resolver) request:0x7fad52e01e20 Unref ev_driver 0x7fad52e1e940
I0910 15:37:15.242542000 123145351360512 completion_queue.cc:966]      grpc_completion_queue_next(cq=0x7fad52f10850, deadline=gpr_timespec { tv_sec: 1568101035, tv_nsec: 442529000, clock_type: 1 }, reserved=0x0)
I0910 15:37:15.321838000 4638729664 completion_queue.cc:966]           grpc_completion_queue_next(cq=0x7fad52dab120, deadline=gpr_timespec { tv_sec: 1568101035, tv_nsec: 521824000, clock_type: 1 }, reserved=0x0)
I0910 15:37:15.448401000 123145351360512 completion_queue.cc:966]      grpc_completion_queue_next(cq=0x7fad52f10850, deadline=gpr_timespec { tv_sec: 1568101035, tv_nsec: 648393000, clock_type: 1 }, reserved=0x0)
I0910 15:37:15.525956000 4638729664 completion_queue.cc:966]           grpc_completion_queue_next(cq=0x7fad52dab120, deadline=gpr_timespec { tv_sec: 1568101035, tv_nsec: 725938000, clock_type: 1 }, reserved=0x0)
I0910 15:37:15.654680000 123145351360512 completion_queue.cc:966]      grpc_completion_queue_next(cq=0x7fad52f10850, deadline=gpr_timespec { tv_sec: 1568101035, tv_nsec: 854662000, clock_type: 1 }, reserved=0x0)
I0910 15:37:15.730330000 4638729664 completion_queue.cc:966]           grpc_completion_queue_next(cq=0x7fad52dab120, deadline=gpr_timespec { tv_sec: 1568101035, tv_nsec: 930314000, clock_type: 1 }, reserved=0x0)
I0910 15:37:15.856281000 123145351360512 completion_queue.cc:966]      grpc_completion_queue_next(cq=0x7fad52f10850, deadline=gpr_timespec { tv_sec: 1568101036, tv_nsec: 56266000, clock_type: 1 }, reserved=0x0)
I0910 15:37:15.935796000 4638729664 completion_queue.cc:966]           grpc_completion_queue_next(cq=0x7fad52dab120, deadline=gpr_timespec { tv_sec: 1568101036, tv_nsec: 135783000, clock_type: 1 }, reserved=0x0)
I0910 15:37:16.060845000 123145351360512 completion_queue.cc:966]      grpc_completion_queue_next(cq=0x7fad52f10850, deadline=gpr_timespec { tv_sec: 1568101036, tv_nsec: 242524928, clock_type: 1 }, reserved=0x0)
I0910 15:37:16.140403000 4638729664 completion_queue.cc:966]           grpc_completion_queue_next(cq=0x7fad52dab120, deadline=gpr_timespec { tv_sec: 1568101036, tv_nsec: 340387000, clock_type: 1 }, reserved=0x0)
D0910 15:37:16.234024000 123145351897088 grpc_ares_ev_driver.cc:264]   (c-ares resolver) request:0x7fad52e01e20 ev_driver=0x7fad52e1e940 on_ares_backup_poll_alarm_locked. driver->shutting_down=0. err="No Error"
D0910 15:37:16.234065000 123145351897088 grpc_ares_ev_driver.cc:272]   (c-ares resolver) request:0x7fad52e01e20 ev_driver=0x7fad52e1e940 on_ares_backup_poll_alarm_locked; ares_process_fd. fd=c-ares fd: 9
D0910 15:37:16.234206000 123145351897088 grpc_ares_ev_driver.cc:233]   (c-ares resolver) request:0x7fad52e01e20 ev_driver=0x7fad52e1e940. next ares process poll time in 1000 ms
D0910 15:37:16.234221000 123145351897088 grpc_ares_ev_driver.cc:98]    (c-ares resolver) request:0x7fad52e01e20 Ref ev_driver 0x7fad52e1e940
D0910 15:37:16.234254000 123145351897088 grpc_ares_ev_driver.cc:363]   (c-ares resolver) request:0x7fad52e01e20 new fd: c-ares fd: 14
D0910 15:37:16.234269000 123145351897088 grpc_ares_ev_driver.cc:98]    (c-ares resolver) request:0x7fad52e01e20 Ref ev_driver 0x7fad52e1e940
D0910 15:37:16.234283000 123145351897088 grpc_ares_ev_driver.cc:382]   (c-ares resolver) request:0x7fad52e01e20 notify read on: c-ares fd: 14
D0910 15:37:16.234319000 123145351897088 grpc_ares_ev_driver.cc:105]   (c-ares resolver) request:0x7fad52e01e20 Unref ev_driver 0x7fad52e1e940
I0910 15:37:16.247665000 123145351360512 completion_queue.cc:966]      grpc_completion_queue_next(cq=0x7fad52f10850, deadline=gpr_timespec { tv_sec: 1568101036, tv_nsec: 447648000, clock_type: 1 }, reserved=0x0)
D0910 15:37:16.266084000 4638729664 grpc_ares_ev_driver.cc:298]        (c-ares resolver) request:0x7fad52e01e20 readable on c-ares fd: 14
D0910 15:37:16.266138000 4638729664 grpc_ares_wrapper.cc:243]          (c-ares resolver) request:0x7fad52e01e20 on_hostbyname_done_locked host=ai-school.grpc-service.gllue.net C-ares status is not ARES_SUCCESS: DNS server returned answer with no data
D0910 15:37:16.266156000 4638729664 grpc_ares_ev_driver.cc:105]        (c-ares resolver) request:0x7fad52e01e20 Unref ev_driver 0x7fad52e1e940
D0910 15:37:16.266185000 4638729664 grpc_ares_ev_driver.cc:119]        (c-ares resolver) request:0x7fad52e01e20 delete fd: c-ares fd: 14
D0910 15:37:16.266202000 4638729664 grpc_ares_ev_driver.cc:105]        (c-ares resolver) request:0x7fad52e01e20 Unref ev_driver 0x7fad52e1e940
D0910 15:37:16.266214000 4638729664 grpc_ares_ev_driver.cc:243]        (c-ares resolver) request:0x7fad52e01e20 ev_driver=0x7fad52e1e940 on_timeout_locked. driver->shutting_down=1. err="Cancelled"
D0910 15:37:16.266222000 4638729664 grpc_ares_ev_driver.cc:105]        (c-ares resolver) request:0x7fad52e01e20 Unref ev_driver 0x7fad52e1e940
D0910 15:37:16.266231000 4638729664 grpc_ares_ev_driver.cc:264]        (c-ares resolver) request:0x7fad52e01e20 ev_driver=0x7fad52e1e940 on_ares_backup_poll_alarm_locked. driver->shutting_down=1. err="Cancelled"
D0910 15:37:16.266239000 4638729664 grpc_ares_ev_driver.cc:105]        (c-ares resolver) request:0x7fad52e01e20 Unref ev_driver 0x7fad52e1e940
D0910 15:37:16.266247000 4638729664 grpc_ares_ev_driver.cc:298]        (c-ares resolver) request:0x7fad52e01e20 readable on c-ares fd: 9
D0910 15:37:16.266254000 4638729664 grpc_ares_ev_driver.cc:119]        (c-ares resolver) request:0x7fad52e01e20 delete fd: c-ares fd: 9
D0910 15:37:16.266262000 4638729664 grpc_ares_ev_driver.cc:420]        (c-ares resolver) request:0x7fad52e01e20 ev driver stop working
D0910 15:37:16.266269000 4638729664 grpc_ares_ev_driver.cc:105]        (c-ares resolver) request:0x7fad52e01e20 Unref ev_driver 0x7fad52e1e940
D0910 15:37:16.266276000 4638729664 grpc_ares_ev_driver.cc:108]        (c-ares resolver) request:0x7fad52e01e20 destroy ev_driver 0x7fad52e1e940
I0910 15:37:16.266346000 4638729664 grpc_ares_wrapper.cc:92]           c-ares address sorting: input[0]=127.0.0.1:50051
I0910 15:37:16.266463000 4638729664 grpc_ares_wrapper.cc:92]           c-ares address sorting: output[0]=127.0.0.1:50051
I0910 15:37:16.267018000 123145351360512 init.cc:163]                  grpc_init(void)
I0910 15:37:16.267056000 4638729664 subchannel.cc:1086]                New connected subchannel at 0x7fad52c7bee0 for subchannel 0x7fad52dac860
I0910 15:37:16.267215000 123145351360512 call.cc:1526]                 ops[0]: RECV_INITIAL_METADATA ptr=0x7fad54828ad8
I0910 15:37:16.267288000 123145351360512 completion_queue.cc:688]      cq_end_op_for_next(cq=0x7fad52f10850, tag=0x10efae868, error="No Error", done=0x10defc4f0, done_arg=0x7fad52f06b80, storage=0x7fad52f06bb8)
I0910 15:37:16.267309000 123145351360512 completion_queue.cc:1066]     RETURN_EVENT[0x7fad52f10850]: OP_COMPLETE: tag:0x10efae868 OK
I0910 15:37:16.267354000 123145351360512 metadata_array.cc:34]         grpc_metadata_array_destroy(array=0x10efae8a0)
I0910 15:37:16.267476000 123145351360512 call.cc:1927]                 grpc_call_start_batch(call=0x7fad54828060, ops=0x7fad52e31720, nops=1, tag=0x10efea0a0, reserved=0x0)
I0910 15:37:16.267485000 123145351360512 call.cc:1526]                 ops[0]: RECV_CLOSE_ON_SERVER cancelled=0x10ef25dd0
I0910 15:37:16.267754000 123145351360512 init.cc:163]                  grpc_init(void)
I0910 15:37:16.267764000 123145351360512 init.cc:163]                  grpc_init(void)
I0910 15:37:16.267772000 123145351360512 call_details.cc:31]           grpc_call_details_init(cd=0x10efca820)
I0910 15:37:16.267778000 123145351360512 metadata_array.cc:29]         grpc_metadata_array_init(array=0x10eff5220)
I0910 15:37:16.267785000 123145351360512 server.cc:1479]               grpc_server_request_call(server=0x7fad52da5f10, call=0x10efe99f8, details=0x10efca820, initial_metadata=0x10eff5220, cq_bound_to_call=0x7fad52f10850, cq_for_notification=0x7fad52f10850, tag=0x10eff51e8)
I0910 15:37:16.267802000 123145351360512 completion_queue.cc:966]      grpc_completion_queue_next(cq=0x7fad52f10850, deadline=gpr_timespec { tv_sec: 1568101036, tv_nsec: 467799000, clock_type: 1 }, reserved=0x0)
I0910 15:37:16.267832000 123145357152256 call.cc:1927]                 grpc_call_start_batch(call=0x7fad54828060, ops=0x7fad52c7e0e0, nops=1, tag=0x10efea0f8, reserved=0x0)
I0910 15:37:16.267845000 123145357152256 call.cc:1526]                 ops[0]: RECV_MESSAGE ptr=0x10efa1a20
I0910 15:37:16.267857000 123145357152256 completion_queue.cc:688]      cq_end_op_for_next(cq=0x7fad52f10850, tag=0x10efea0f8, error="No Error", done=0x10def2aa0, done_arg=0x7fad5482a4b0, storage=0x7fad5482a500)
I0910 15:37:16.267891000 123145351360512 completion_queue.cc:1066]     RETURN_EVENT[0x7fad52f10850]: OP_COMPLETE: tag:0x10efea0f8 OK
I0910 15:37:16.267953000 123145351360512 completion_queue.cc:966]      grpc_completion_queue_next(cq=0x7fad52f10850, deadline=gpr_timespec { tv_sec: 1568101036, tv_nsec: 467950000, clock_type: 1 }, reserved=0x0)
I0910 15:37:16.268062000 123145357152256 call.cc:1927]                 grpc_call_start_batch(call=0x7fad54828060, ops=0x7fad52c5f260, nops=3, tag=0x10efea0f8, reserved=0x0)
I0910 15:37:16.268073000 123145357152256 call.cc:1526]                 ops[0]: SEND_STATUS_FROM_SERVER status=0 details=(nil)
I0910 15:37:16.268079000 123145357152256 call.cc:1526]                 ops[1]: SEND_INITIAL_METADATA(nil)
I0910 15:37:16.268084000 123145357152256 call.cc:1526]                 ops[2]: SEND_MESSAGE ptr=0x7fad52c82d20
I0910 15:37:16.268124000 123145357152256 completion_queue.cc:688]      cq_end_op_for_next(cq=0x7fad52f10850, tag=0x10efea0a0, error="No Error", done=0x10def2aa0, done_arg=0x7fad5482a3d0, storage=0x7fad5482a420)
I0910 15:37:16.268138000 123145357152256 completion_queue.cc:688]      cq_end_op_for_next(cq=0x7fad52f10850, tag=0x10efea0f8, error="No Error", done=0x10def2aa0, done_arg=0x7fad5482a590, storage=0x7fad5482a5e0)
I0910 15:37:16.268181000 123145357152256 call_details.cc:37]           grpc_call_details_destroy(cd=0x10efca190)
I0910 15:37:16.268178000 123145351360512 completion_queue.cc:1066]     RETURN_EVENT[0x7fad52f10850]: OP_COMPLETE: tag:0x10efea0a0 OK
I0910 15:37:16.268189000 123145357152256 init.cc:223]                  grpc_shutdown_blocking(void)
I0910 15:37:16.268217000 4638729664 completion_queue.cc:688]           cq_end_op_for_next(cq=0x7fad52dab120, tag=0x10efde150, error="No Error", done=0x10def2aa0, done_arg=0x7fad538968c0, storage=0x7fad53896910)
I0910 15:37:16.268228000 4638729664 completion_queue.cc:1066]          RETURN_EVENT[0x7fad52dab120]: OP_COMPLETE: tag:0x10efde150 OK
I0910 15:37:16.268239000 4638729664 metadata_array.cc:34]              grpc_metadata_array_destroy(array=0x10efdaa98)
I0910 15:37:16.268249000 4638729664 metadata_array.cc:34]              grpc_metadata_array_destroy(array=0x10ec19a18)
I0910 15:37:16.268260000 4638729664 call.cc:573]                       grpc_call_unref(c=0x7fad53895a60)
I0910 15:37:16.268271000 4638729664 completion_queue.cc:1404]          grpc_completion_queue_shutdown(cq=0x7fad52dab120)
I0910 15:37:16.268276000 4638729664 completion_queue.cc:1410]          grpc_completion_queue_destroy(cq=0x7fad52dab120)
I0910 15:37:16.268280000 4638729664 completion_queue.cc:1404]          grpc_completion_queue_shutdown(cq=0x7fad52dab120)
I0910 15:37:16.269998000 4638729664 completion_queue.cc:1404]          grpc_completion_queue_shutdown(cq=0x7fad52da9e40)
I0910 15:37:16.270016000 4638729664 completion_queue.cc:1410]          grpc_completion_queue_destroy(cq=0x7fad52da9e40)
I0910 15:37:16.270022000 4638729664 completion_queue.cc:1404]          grpc_completion_queue_shutdown(cq=0x7fad52da9e40)
I0910 15:37:16.270027000 4638729664 completion_queue.cc:1404]          grpc_completion_queue_shutdown(cq=0x7fad52daa660)
I0910 15:37:16.270032000 4638729664 completion_queue.cc:1410]          grpc_completion_queue_destroy(cq=0x7fad52daa660)
I0910 15:37:16.270035000 4638729664 completion_queue.cc:1404]          grpc_completion_queue_shutdown(cq=0x7fad52daa660)
I0910 15:37:16.270041000 4638729664 channel.cc:500]                    grpc_channel_destroy(channel=0x7fad52da7040)
D0910 15:37:16.270049000 4638729664 dns_resolver_ares.cc:167]          (c-ares resolver) resolver:0x7fad52e2e530 destroying AresDnsResolver
I0910 15:37:16.270103000 4638729664 init.cc:208]                       grpc_shutdown(void)
I0910 15:37:16.270185000 4638729664 init.cc:223]                       grpc_shutdown_blocking(void)
I0910 15:37:16.270276000 4638729664 server.cc:1295]                    grpc_server_shutdown_and_notify(server=0x7fad52da5f10, cq=0x7fad52f10850, tag=0x10ef8ae48)
I0910 15:37:16.270297000 4638729664 completion_queue.cc:688]           cq_end_op_for_next(cq=0x7fad52f10850, tag=0x10eff51e8, error={"created":"@1568101036.270283000","description":"Server Shutdown","file":"src/core/lib/surface/server.cc","file_line":1333}, done=0x10defc4f0, done_arg=0x7fad52c1cdf0, storage=0x7fad52c1ce28)
I0910 15:37:16.270334000 123145351360512 completion_queue.cc:966]      grpc_completion_queue_next(cq=0x7fad52f10850, deadline=gpr_timespec { tv_sec: 1568101036, tv_nsec: 470328000, clock_type: 1 }, reserved=0x0)
I0910 15:37:16.270340000 4638729664 chttp2_transport.cc:1815]          ipv4:127.0.0.1:52950: Sending goaway err={"created":"@1568101036.270309000","description":"Server shutdown","file":"src/core/lib/surface/server.cc","file_line":321,"grpc_status":0}
I0910 15:37:16.270362000 123145351360512 completion_queue.cc:1066]     RETURN_EVENT[0x7fad52f10850]: OP_COMPLETE: tag:0x10efea0f8 OK
I0910 15:37:16.270375000 123145351360512 call.cc:573]                  grpc_call_unref(c=0x7fad54828060)
I0910 15:37:16.270382000 123145351360512 metadata_array.cc:34]         grpc_metadata_array_destroy(array=0x7fad54828ad8)
I0910 15:37:16.270394000 123145351360512 init.cc:223]                  grpc_shutdown_blocking(void)
I0910 15:37:16.270429000 4638729664 init.cc:208]                       grpc_shutdown(void)
I0910 15:37:16.270459000 4638729664 completion_queue.cc:688]           cq_end_op_for_next(cq=0x7fad52f10850, tag=0x10ef8ae48, error="No Error", done=0x10defc6d0, done_arg=0x7fad52da5f10, storage=0x7fad52da78f0)
I0910 15:37:16.270730000 123145351360512 completion_queue.cc:966]      grpc_completion_queue_next(cq=0x7fad52f10850, deadline=gpr_timespec { tv_sec: 1568101036, tv_nsec: 470726000, clock_type: 1 }, reserved=0x0)
I0910 15:37:16.270745000 123145351360512 completion_queue.cc:1066]     RETURN_EVENT[0x7fad52f10850]: OP_COMPLETE: tag:0x10eff51e8 ERROR
I0910 15:37:16.270755000 123145351360512 metadata_array.cc:34]         grpc_metadata_array_destroy(array=0x10eff5220)
I0910 15:37:16.270772000 123145351360512 init.cc:223]                  grpc_shutdown_blocking(void)
I0910 15:37:16.270778000 123145351360512 call_details.cc:37]           grpc_call_details_destroy(cd=0x10efca820)
I0910 15:37:16.270783000 123145351360512 init.cc:223]                  grpc_shutdown_blocking(void)
I0910 15:37:16.270790000 123145351360512 completion_queue.cc:966]      grpc_completion_queue_next(cq=0x7fad52f10850, deadline=gpr_timespec { tv_sec: 1568101036, tv_nsec: 470788000, clock_type: 1 }, reserved=0x0)
I0910 15:37:16.270798000 123145351360512 completion_queue.cc:1066]     RETURN_EVENT[0x7fad52f10850]: OP_COMPLETE: tag:0x10ef8ae48 OK
I0910 15:37:16.270813000 123145351360512 server.cc:1381]               grpc_server_destroy(server=0x7fad52da5f10)
result: "test"

cost time:  6.047182083129883
I0910 15:37:16.279866000 4638729664 init.cc:223]                       grpc_shutdown_blocking(void)
I0910 15:37:16.279886000 4638729664 completion_queue.cc:1404]          grpc_completion_queue_shutdown(cq=0x7fad52e32880)
I0910 15:37:16.279895000 4638729664 completion_queue.cc:966]           grpc_completion_queue_next(cq=0x7fad52e32880, deadline=gpr_timespec { tv_sec: 9223372036854775807, tv_nsec: 0, clock_type: 1 }, reserved=0x0)
I0910 15:37:16.279901000 4638729664 completion_queue.cc:1066]          RETURN_EVENT[0x7fad52e32880]: QUEUE_SHUTDOWN
I0910 15:37:16.279909000 4638729664 completion_queue.cc:1410]          grpc_completion_queue_destroy(cq=0x7fad52e32880)
I0910 15:37:16.279913000 4638729664 completion_queue.cc:1404]          grpc_completion_queue_shutdown(cq=0x7fad52e32880)
I0910 15:37:16.279926000 4638729664 init.cc:223]                       grpc_shutdown_blocking(void)
I0910 15:37:16.279930000 4638729664 completion_queue.cc:1404]          grpc_completion_queue_shutdown(cq=0x7fad52f10850)
I0910 15:37:16.279938000 4638729664 completion_queue.cc:966]           grpc_completion_queue_next(cq=0x7fad52f10850, deadline=gpr_timespec { tv_sec: 9223372036854775807, tv_nsec: 0, clock_type: 1 }, reserved=0x0)
I0910 15:37:16.279943000 4638729664 completion_queue.cc:1066]          RETURN_EVENT[0x7fad52f10850]: QUEUE_SHUTDOWN
I0910 15:37:16.279947000 4638729664 completion_queue.cc:1410]          grpc_completion_queue_destroy(cq=0x7fad52f10850)
I0910 15:37:16.279950000 4638729664 completion_queue.cc:1404]          grpc_completion_queue_shutdown(cq=0x7fad52f10850)
I0910 15:37:16.279957000 4638729664 init.cc:223]                       grpc_shutdown_blocking(void)
```

**Comment by apolcyn** [comment]
Thanks for the log snippet.

This log shows that DNS resolution succeeded though. However, it took ~6 seconds (which is still interesting).

Right off the bat, we see:

```
D0910 15:37:10.227637000 4638729664 grpc_ares_wrapper.cc:233]          (c-ares resolver) request:0x7fad52e01e20 c-ares resolver gets a AF_INET result:
  addr: 127.0.0.1
  port: 50051
```

this is before the c-ares resolver created any file descriptors. So the IPv4 address was found from your /etc/hosts file.

However, the first AAAA query (first created in file descriptor 9), seems to time out.

It's strange because we first see a `readable on c-ares fd: 9` on that fd, right after it was created, but then there's no activity on it for quite a while. After ~6 seconds we create a new file descriptor (fd 14). This one is probably to the second DNS server in your system's DNS server list. It gets an ENODATA response right away.

A couple of questions:

1) What makes you say that the DNS resolution "timed out"? This log shows that it succeeded.

2) For further debugging, how easy is it for you to reproduce this? Can you run tcpdump in the background of this test, and share a pcap file here? E.g., running a command like this one in the background of your test:

```
sudo tcpdump -i <your interface> 'port 53' -w test.pcap
```

This could show exactly what happened with that first DNS query (in this log, the one on file descriptor 9).

**Comment by GuangTianLi** [comment]
@apolcyn
The reason that I said DNS resolution "time out" is this:

> D0910 15:37:16.266214000 4638729664 grpc_ares_ev_driver.cc:243]        (c-ares resolver) request:0x7fad52e01e20 ev_driver=0x7fad52e1e940 on_timeout_locked. driver->shutting_down=1. err="Cancelled"

And the "ev_driver"  :
> D0910 15:37:10.227644000 4638729664 grpc_ares_ev_driver.cc:363]        (c-ares resolver) request:0x7fad52e01e20 new fd: c-ares fd: 9

is used in `grpc_ares_query_ipv6`. So I think you already have an idea to that.

**Comment by apolcyn** [comment]
> The reason that I said DNS resolution "time out" is this:

Note `on_timeout_locked. driver->shutting_down=1. err="Cancelled"` actually means that the DNS resolution <i>didn't</i> time out. An `err` parameter of "Cancelled" means that the DNS resolution's deadline timer itself was cancelled, because the resolution <i>finished</i> (either due to success or failure).

If you'd like to analyze why the first DNS query on fd 9 took a while though, please see question 2) in https://github.com/grpc/grpc/issues/20216#issuecomment-532052882 - it's very hard to say further what happened without that info.

**Comment by GuangTianLi** [comment]
@apolcyn
`mysql` in my hosts file points to 127.0.0.1.
```text
tcpdump: verbose output suppressed, use -v or -vv for full protocol decode
listening on en0, link-type EN10MB (Ethernet), capture size 262144 bytes
13:54:18.630423 IP macbook-pro-2.54991 > router.asus.com.domain: 13609+ AAAA? mysql. (23)
13:54:18.632030 IP macbook-pro-2.50244 > router.asus.com.domain: 38685+ PTR? 121.50.168.192.in-addr.arpa. (45)
13:54:18.634315 IP router.asus.com.domain > macbook-pro-2.50244: 38685* 1/0/0 PTR MacBook-Pro-2. (72)
13:54:18.635238 IP macbook-pro-2.58646 > router.asus.com.domain: 28449+ PTR? 1.50.168.192.in-addr.arpa. (43)
13:54:18.636377 IP router.asus.com.domain > macbook-pro-2.58646: 28449* 1/0/0 PTR router.asus.com. (72)
13:54:24.633986 IP macbook-pro-2.54991 > router.asus.com.domain: 13609+ AAAA? mysql. (23)
13:54:24.644769 IP router.asus.com.domain > macbook-pro-2.54991: 13609 NXDomain 0/1/0 (98)
```
Are you sure you need dump file from tcpdump?

**Comment by apolcyn** [comment]
@GuangTianLi thanks, yes this is helpful. We can see here that a first query was made to `router.asus.com`, but didn't see a response. Then a second one was made, and it got an NXDOAIN right away.

I see there that there were two AAAA lookups to `router.asus.com`, but I'm still not sure if they are actually the same DNS server; reversing DNS lookups in tcpdump would tell us. Can you also run tcpdump with "-n", to disable reverse DNS lookups?

**Comment by GuangTianLi** [comment]
> @GuangTianLi thanks, yes this is helpful. We can see here that a first query was made to `router.asus.com`, but didn't see a response. Then a second one was made, and it got an NXDOAIN right away.
> 
> I see there that there were two AAAA lookups to `router.asus.com`, but I'm still not sure if they are actually the same DNS server; reversing DNS lookups in tcpdump would tell us. Can you also run tcpdump with "-n", to disable reverse DNS lookups?

```text
14:22:47.823940 IP (tos 0x0, ttl 64, id 45993, offset 0, flags [none], proto UDP (17), length 51)
    192.168.50.121.61914 > 192.168.50.1.53: [udp sum ok] 13609+ AAAA? mysql. (23)
14:22:52.832774 IP (tos 0x0, ttl 64, id 62881, offset 0, flags [none], proto UDP (17), length 51)
    192.168.50.121.61914 > 192.168.50.1.53: [udp sum ok] 13609+ AAAA? mysql. (23)
14:22:52.842517 IP (tos 0x0, ttl 64, id 4342, offset 0, flags [DF], proto UDP (17), length 126)
    192.168.50.1.53 > 192.168.50.121.61914: [udp sum ok] 13609 NXDomain q: AAAA? mysql. 0/1/0 ns: . [6m] SOA a.root-servers.net. nstld.verisign-grs.com. 2019091700 1800 900 604800 86400 (98)
```

**Comment by apolcyn** [comment]
Strange...... two requests to the same DNS server; the first one times out and the second one succeeds right away.

Does this reproduce for you 100% of the time?

**Comment by GuangTianLi** [comment]
> Strange...... two requests to the same DNS server; the first one times out and the second one succeeds right away.
> 
> Does this reproduce for you 100% of the time?

Yes, I feel strange too and the interesting thing is that it does not reproduce 100% of the time in my computer now, but in my co-worker‘s computer all the time.

**Comment by apolcyn** [comment]
Ok, one idea for comparison is to see how this compares to the native resolver. 

Can you run that same tcpdump command in the background of running this command:

`dig AAAA mysql` ?

and share the packet trace?

**Comment by GuangTianLi** [comment]
There is output:

```text
09:38:12.281946 IP (tos 0x0, ttl 64, id 48244, offset 0, flags [none], proto UDP (17), length 74)
    10.0.3.123.35416 > 10.0.0.1.53: [bad udp cksum 0x17c3 -> 0x4f59!] 45908+ [1au] AAAA? mysql. ar: . OPT UDPsize=4096 (46)
09:38:13.281642 IP (tos 0x0, ttl 64, id 19375, offset 0, flags [none], proto UDP (17), length 74)
    10.0.3.123.35302 > 114.114.114.114.53: [bad udp cksum 0xf2a6 -> 0x74e7!] 45908+ [1au] AAAA? mysql. ar: . OPT UDPsize=4096 (46)
09:38:13.288275 IP (tos 0x20, ttl 153, id 0, offset 0, flags [none], proto UDP (17), length 137)
    114.114.114.114.53 > 10.0.3.123.35302: [udp sum ok] 45908 NXDomain q: AAAA? mysql. 0/1/1 ns: . [55m47s] SOA a.root-servers.net. nstld.verisign-grs.com. 2019091703 1800 900 604800 86400 ar: . OPT UDPsize=4096 (109)
09:38:15.231938 IP (tos 0x0, ttl 64, id 48772, offset 0, flags [DF], proto UDP (17), length 63)
    10.0.3.123.35863 > 10.0.0.1.53: [bad udp cksum 0x17b8 -> 0x011e!] 35028+ AAAA? www.archlinux.org. (35)
09:38:15.232796 IP (tos 0x0, ttl 64, id 0, offset 0, flags [DF], proto UDP (17), length 129)
    10.0.0.1.53 > 10.0.3.123.35863: [udp sum ok] 35028 q: AAAA? www.archlinux.org. 2/0/0 www.archlinux.org. [1m20s] CNAME apollo.archlinux.org., apollo.archlinux.org. [1m20s] AAAA 2a01:4f8:172:1d86::1 (101)
```

And it can not reproduce in my computer now, so the output is from my co-worker computer with Linux.
