### ISSUE TITLE
[c++]grpc server close connection for window overflow

### ISSUE THREAD

**Issue by yancl** [grpc/grpc#10729]
Hi,
  I have a grpc **c++** server and a grpc **go** client, they communicate with each other by a **bi-direction stream**. when the go client send some messages, the client got some error:
`2017/04/19 12:36:15 transport: http2Client.notifyError got notified that the client transport was broken EOF.`

and through tcpdump i find that the server close the connection(port 50051 is the server):
```
12:36:15.165077 IP 127.0.0.1.56209 > 127.0.0.1.50051: Flags [P.], seq 1810591:1815067, ack 2687, win 434, options [nop,nop,TS val 7919327 ecr 7919326], length 4476
12:36:15.166217 IP 127.0.0.1.50051 > 127.0.0.1.56209: Flags [F.], seq 2687, ack 1815067, win 19309, options [nop,nop,TS val 7919327 ecr 7919327], length 0
12:36:15.166249 IP 127.0.0.1.56209 > 127.0.0.1.50051: Flags [.], seq 1815067:1880550, ack 2688, win 434, options [nop,nop,TS val 7919327 ecr 7919327], length 65483
12:36:15.166649 IP 127.0.0.1.56209 > 127.0.0.1.50051: Flags [P.], seq 1880550:1916099, ack 2688, win 434, options [nop,nop,TS val 7919328 ecr 7919327], length 35549
12:36:15.166898 IP 127.0.0.1.50051 > 127.0.0.1.56209: Flags [R], seq 1317965835, win 0, length 0
```

then i found some debug log from grpc server:
```
D0419 12:36:15.165398502   22422 chttp2_transport.c:2154]    set connectivity_state=4
D0419 12:36:15.165401804   22422 connectivity_state.c:184]   SET: 0x7fe200001438 server_transport: READY --> SHUTDOWN [close_transport] error=0x7fe20c01f780 {"created":"@1492605375.128074698","description":"Delayed close due to in-progress write","file":"src/core/ext/transport/chttp2/transport/chttp2_transport.c","file_line":521,"referenced_errors":[{"created":"@1492605375.128072799","description":"Failed parsing HTTP/2","file":"src/core/ext/transport/chttp2/transport/chttp2_transport.c","file_line":1971,"grpc_status":14,"referenced_errors":[{"created":"@1492605375.128069267","description":"frame of size 4467 overflows incoming window of 911","file":"src/core/ext/transport/chttp2/transport/parsing.c","file_line":412}]}]}
D0419 12:36:15.166190700   22422 connectivity_state.c:211]   NOTIFY: 0x7fe200001438 server_transport: 0x7fe200005350
```

according the log, the server says that:`frame of size 4467 overflows incoming window of 911`,
so is this a  bug or mis-config param for grpc server?

I don't want the connection be broken, how can i make it? thanks.

**Comment by yancl** [comment]
and i found a similar issue from here:
https://github.com/netty/netty/issues/6520

**Comment by yancl** [comment]
I test the same scenario with grpc c++ client, it works well. but with the grpc golang client, the problem appears. so i close it here and issue [another](https://github.com/grpc/grpc-go/issues/1192) for grpc golang, thanks.

**Comment by yancl** [comment]
according the issue described [here](https://github.com/grpc/grpc-go/issues/1192) and the comments for how to produce it, i don't know whether it is a c++ implement problem. so i reopen the issue.

**Comment by yancl** [comment]
https://github.com/grpc/grpc-go/pull/1268 fixed it for unsigned integer overflow, so i close it now, thank you for your help:)
