### ISSUE TITLE
gRPC client follows its TCP FIN with RST

### ISSUE THREAD

**Issue by marcindulak** [grpc/grpc#38231]
### What version of gRPC and what language are you using?

https://github.com/grpc/grpc/releases/tag/v1.68.1 (also https://github.com/grpc/grpc/releases/tag/v1.67.0)

### What operating system (Linux, Windows,...) and version?

```
   docker exec -it grpc bash -c "cat /etc/*release | grep PRETTY"
   docker exec -it grpc bash -c "uname -a && tshark --version"
   docker --version

   # PRETTY_NAME="Debian GNU/Linux trixie/sid"
   # Linux 79ae7d0391cd 6.6.51-0-virt #1-Alpine SMP PREEMPT_DYNAMIC 2024-09-12 12:56:22 aarch64 GNU/Linux
   # TShark (Wireshark) 4.4.1.
   # Docker version 27.2.1-rd, build cc0ee3e
```

### What runtime / compiler are you using (e.g. python version or version of gcc)

```
docker exec -it grpc bash -c "python3 -V"

# Python 3.12.8
```

### What did you do?

I'm using the stock example of unary client/server from https://grpc.io/docs/languages/python/quickstart/, and seeing
that gRPC client issues TCP RST after its TCP FIN.
It's a problem similar to a recently fixed https://github.com/grpc/grpc-go/issues/2869

This behavior is non-deteministic, but Python client + server are affected more consistently than Golang client + server.

To reproduce, follow instructions at https://github.com/marcindulak/grpc-client-tcp-rst

### What did you expect to see?

The gRPC client after sending its TCP FIN, receives a TCP FIN from the server, and closes the connection with TCP ACK.
Below is an example of an expected behavior from a Golang client+server.

```
docker exec -it grpc sh -c "tshark -r /opt/grpc-go/golang_golang.pcap"

#    1   0.000000    127.0.0.1 ? 127.0.0.1    TCP 74 42136 ? 50051 [SYN] Seq=0 Win=65495 Len=0 MSS=65495 SACK_PERM TSval=2409056769 TSecr=0 WS=128
#    2   0.000030    127.0.0.1 ? 127.0.0.1    TCP 74 50051 ? 42136 [SYN, ACK] Seq=0 Ack=1 Win=65483 Len=0 MSS=65495 SACK_PERM TSval=2409056769 TSecr=2409056769 WS=128
#    3   0.000051    127.0.0.1 ? 127.0.0.1    TCP 66 42136 ? 50051 [ACK] Seq=1 Ack=1 Win=65536 Len=0 TSval=2409056769 TSecr=2409056769
#    4   0.000688    127.0.0.1 ? 127.0.0.1    TCP 81 50051 ? 42136 [PSH, ACK] Seq=1 Ack=1 Win=65536 Len=15 TSval=2409056770 TSecr=2409056769
#    5   0.000714    127.0.0.1 ? 127.0.0.1    HTTP2 90 Magic
#    6   0.000773    127.0.0.1 ? 127.0.0.1    TCP 66 50051 ? 42136 [ACK] Seq=16 Ack=25 Win=65536 Len=0 TSval=2409056770 TSecr=2409056770
#    7   0.000792    127.0.0.1 ? 127.0.0.1    TCP 66 42136 ? 50051 [ACK] Seq=25 Ack=16 Win=65536 Len=0 TSval=2409056770 TSecr=2409056770
#    8   0.000869    127.0.0.1 ? 127.0.0.1    HTTP2 75 SETTINGS[0]
#    9   0.000875    127.0.0.1 ? 127.0.0.1    TCP 66 50051 ? 42136 [ACK] Seq=16 Ack=34 Win=65536 Len=0 TSval=2409056770 TSecr=2409056770
#   10   0.001214    127.0.0.1 ? 127.0.0.1    HTTP2 75 SETTINGS[0]
#   11   0.001249    127.0.0.1 ? 127.0.0.1    HTTP2 175 SETTINGS[0], HEADERS[1]: POST /helloworld.Greeter/SayHello
#   12   0.001317    127.0.0.1 ? 127.0.0.1    GRPC/PB(<UNKNOWN>) 87 DATA[1] (GRPC) (PROTOBUF)
#   13   0.001365    127.0.0.1 ? 127.0.0.1    TCP 66 50051 ? 42136 [ACK] Seq=25 Ack=164 Win=65536 Len=0 TSval=2409056771 TSecr=2409056771
#   14   0.001764    127.0.0.1 ? 127.0.0.1    GRPCHTTP2 179 WINDOW_UPDATE[0], PING[0], HEADERS[1]: 200 OK, DATA[1] (GRPC) (PROTOBUF), HEADERS[1]
#   15   0.002306    127.0.0.1 ? 127.0.0.1    HTTP2 113 PING[0], WINDOW_UPDATE[0], PING[0]
#   16   0.002380    127.0.0.1 ? 127.0.0.1    HTTP2 83 PING[0]
#   17   0.002408    127.0.0.1 ? 127.0.0.1    HTTP2 108 GOAWAY[0]
#   18   0.002455    127.0.0.1 ? 127.0.0.1    TCP 66 42136 ? 50051 [FIN, ACK] Seq=253 Ack=155 Win=65536 Len=0 TSval=2409056772 TSecr=2409056772
#   19   0.002489    127.0.0.1 ? 127.0.0.1    TCP 66 50051 ? 42136 [FIN, ACK] Seq=155 Ack=254 Win=65536 Len=0 TSval=2409056772 TSecr=2409056772
#   20   0.002677    127.0.0.1 ? 127.0.0.1    TCP 66 42136 ? 50051 [ACK] Seq=254 Ack=156 Win=65536 Len=0 TSval=2409056772 TSecr=2409056772
```

### What did you see instead?

The packet capture shows the gRPC client issues TCP RST after its TCP FIN.
This is a Python client + server. The IPv4 vs IPv6 does not seem to make any difference.

```
docker exec -it grpc sh -c "tshark -r /opt/grpc/python_python.pcap"

#    1   0.000000   ::1 ? ::1   TCP 94 45118 ? 50051 [SYN] Seq=0 Win=65476 Len=0 MSS=65476 SACK_PERM TSval=2697583267 TSecr=0 WS=128
#    2   0.000019   ::1 ? ::1   TCP 94 50051 ? 45118 [SYN, ACK] Seq=0 Ack=1 Win=65464 Len=0 MSS=65476 SACK_PERM TSval=2697583267 TSecr=2697583267 WS=128
#    3   0.000040   ::1 ? ::1   TCP 86 45118 ? 50051 [ACK] Seq=1 Ack=1 Win=65536 Len=0 TSval=2697583267 TSecr=2697583267
#    4   0.000533   ::1 ? ::1   HTTP2 168 Magic, SETTINGS[0], WINDOW_UPDATE[0]
#    5   0.000537   ::1 ? ::1   HTTP2 132 SETTINGS[0], WINDOW_UPDATE[0]
#    6   0.000553   ::1 ? ::1   TCP 86 45118 ? 50051 [ACK] Seq=83 Ack=47 Win=65536 Len=0 TSval=2697583267 TSecr=2697583267
#    7   0.000555   ::1 ? ::1   TCP 86 50051 ? 45118 [ACK] Seq=47 Ack=83 Win=65536 Len=0 TSval=2697583268 TSecr=2697583267
#    8   0.000663   ::1 ? ::1   HTTP2 95 SETTINGS[0]
#    9   0.000665   ::1 ? ::1   TCP 86 45118 ? 50051 [ACK] Seq=83 Ack=56 Win=65536 Len=0 TSval=2697583268 TSecr=2697583268
#   10   0.001009   ::1 ? ::1   GRPCHTTP2 366 SETTINGS[0], HEADERS[1]: POST /helloworld.Greeter/SayHello, WINDOW_UPDATE[1], DATA[1] (GRPC) (PROTOBUF), WIND#OW_UPDATE[0]
#   11   0.001188   ::1 ? ::1   HTTP2 103 PING[0]
#   12   0.001226   ::1 ? ::1   HTTP2 103 PING[0]
#   13   0.001990   ::1 ? ::1   GRPCHTTP2 252 HEADERS[1]: 200 OK, DATA[1] (GRPC) (PROTOBUF), HEADERS[1], WINDOW_UPDATE[0]
#   14   0.002156   ::1 ? ::1   HTTP2 103 PING[0] # client -> server
#   15   0.002202   ::1 ? ::1   HTTP2 103 PING[0] # server -> client
#   16   0.002406   ::1 ? ::1   TCP 86 45118 ? 50051 [FIN, ACK] Seq=397 Ack=256 Win=65536 Len=0 TSval=2697583269 TSecr=2697583269
#   17   0.002428   ::1 ? ::1   TCP 86 45118 ? 50051 [RST, ACK] Seq=398 Ack=256 Win=65536 Len=0 TSval=2697583269 TSecr=2697583269
```

### Anything else we should know about your project / environment?

A verbose log of the behavior from Python client + server connection is available at https://github.com/marcindulak/grpc-client-tcp-rst/blob/main/verbose.log

**Comment by a11r** [comment]
Looks like the FIN from the client was never acked by the SERVER. Some
timer expired and the client gave up by sending a RST. This could be
working as intended.

**Comment by marcindulak** [comment]
It may be something related to timeouts, but let me add that I see similar resets between physical machines on a local, cable ethernet network, of a latency of about 1-2ms. I can recreate a similar reset behavior on localhost using tc (when starting the container using `--privileged` option)

```
docker exec -it grpc bash -c "(tc qdisc del dev lo root || true ) && tc qdisc add dev lo root netem delay 002ms"
```

The produced packet capture on localhost looks typically like this
```
docker exec -it grpc sh -c "tshark -r /opt/grpc/python_python_delay_002ms.pcap"

    1   0.000000    localhost → localhost    TCP 41128 → 50051 [SYN] Seq=0 Win=65495 Len=0 MSS=65495 SACK_PERM TSval=2946673464 TSecr=0 WS=128
    2   0.002025    localhost → localhost    TCP 50051 → 41128 [SYN, ACK] Seq=0 Ack=1 Win=65483 Len=0 MSS=65495 SACK_PERM TSval=2946673466 TSecr=2946673464 WS=128
    3   0.004054    localhost → localhost    TCP 41128 → 50051 [ACK] Seq=1 Ack=1 Win=65536 Len=0 TSval=2946673468 TSecr=2946673466
    4   0.004247    localhost → localhost    HTTP2 Magic, SETTINGS[0], WINDOW_UPDATE[0]
    5   0.006225    localhost → localhost    HTTP2 SETTINGS[0], WINDOW_UPDATE[0]
    6   0.006264    localhost → localhost    TCP 50051 → 41128 [ACK] Seq=47 Ack=83 Win=65536 Len=0 TSval=2946673470 TSecr=2946673468
    7   0.006369    localhost → localhost    HTTP2 SETTINGS[0]
    8   0.008244    localhost → localhost    TCP 41128 → 50051 [ACK] Seq=83 Ack=47 Win=65536 Len=0 TSval=2946673472 TSecr=2946673470
    9   0.008340    localhost → localhost    HTTP2 SETTINGS[0]
   10   0.008404    localhost → localhost    GRPCHTTP2 HEADERS[1]: POST /helloworld.Greeter/SayHello, WINDOW_UPDATE[1], DATA[1] (GRPC) (PROTOBUF), WINDOW_UPDATE[0]
   11   0.010479    localhost → localhost    TCP 50051 → 41128 [ACK] Seq=56 Ack=363 Win=65536 Len=0 TSval=2946673474 TSecr=2946673472
   12   0.010496    localhost → localhost    HTTP2 PING[0]
   13   0.010808    localhost → localhost    GRPCHTTP2 HEADERS[1]: 200 OK, DATA[1] (GRPC) (PROTOBUF), HEADERS[1], WINDOW_UPDATE[0]
   14   0.012595    localhost → localhost    HTTP2 PING[0]
   15   0.012901    localhost → localhost    HTTP2 PING[0]
   16   0.013165    localhost → localhost    TCP 41128 → 50051 [FIN, ACK] Seq=397 Ack=239 Win=65536 Len=0 TSval=2946673477 TSecr=2946673475
   17   0.014925    localhost → localhost    TCP 50051 → 41128 [ACK] Seq=239 Ack=397 Win=65536 Len=0 TSval=2946673479 TSecr=2946673476
   18   0.014928    localhost → localhost    HTTP2 PING[0]
   19   0.015196    localhost → localhost    TCP 50051 → 41128 [FIN, ACK] Seq=256 Ack=398 Win=65536 Len=0 TSval=2946673479 TSecr=2946673477
   20   0.016948    localhost → localhost    TCP 41128 → 50051 [RST] Seq=397 Win=0 Len=0
   21   0.017208    localhost → localhost    TCP 41128 → 50051 [RST] Seq=398 Win=0 Len=0
```

The actual capture between physical machines looks like this
```
docker exec -it grpc sh -c "tshark -r /opt/grpc/python_python_client_server.pcap"

    1   0.000000   client → server   TCP 53118 → 50051 [SYN] Seq=0 Win=65535 Len=0 MSS=1460 WS=64 TSval=100527204 TSecr=0 SACK_PERM
    2   0.002500   server → client   TCP 50051 → 53118 [SYN, ACK] Seq=0 Ack=1 Win=65160 Len=0 MSS=1460 SACK_PERM TSval=2425170034 TSecr=100527204 WS=128
    3   0.002690   client → server   TCP 53118 → 50051 [ACK] Seq=1 Ack=1 Win=131712 Len=0 TSval=100527207 TSecr=2425170034
    4   0.003054   client → server   HTTP2 Magic, SETTINGS[0], WINDOW_UPDATE[0]
    5   0.004473   server → client   HTTP2 SETTINGS[0], WINDOW_UPDATE[0]
    6   0.004599   client → server   TCP 53118 → 50051 [ACK] Seq=83 Ack=47 Win=131712 Len=0 TSval=100527209 TSecr=2425170036
    7   0.004720   client → server   GRPCHTTP2 SETTINGS[0], HEADERS[1]: POST /helloworld.Greeter/SayHello, WINDOW_UPDATE[1], DATA[1] (GRPC) (PROTOBUF), WINDOW_UPDATE[0]
    8   0.005422   server → client   TCP 50051 → 53118 [ACK] Seq=47 Ack=83 Win=65280 Len=0 TSval=2425170037 TSecr=100527207
    9   0.005424   server → client   HTTP2 SETTINGS[0]
   10   0.005485   client → server   TCP 53118 → 50051 [ACK] Seq=365 Ack=56 Win=131712 Len=0 TSval=100527209 TSecr=2425170037
   11   0.006410   server → client   HTTP2 PING[0]
   12   0.006459   client → server   TCP 53118 → 50051 [ACK] Seq=365 Ack=73 Win=131648 Len=0 TSval=100527211 TSecr=2425170038
   13   0.006503   client → server   HTTP2 PING[0]
   14   0.007364   server → client   GRPCHTTP2 HEADERS[1]: 200 OK, DATA[1] (GRPC) (PROTOBUF), HEADERS[1], WINDOW_UPDATE[0]
   15   0.007408   client → server   TCP 53118 → 50051 [ACK] Seq=382 Ack=239 Win=131520 Len=0 TSval=100527211 TSecr=2425170039
   16   0.007765   client → server   HTTP2 PING[0]
   17   0.008057   client → server   TCP 53118 → 50051 [FIN, ACK] Seq=399 Ack=239 Win=131520 Len=0 TSval=100527212 TSecr=2425170039
   18   0.009338   server → client   TCP 50051 → 53118 [ACK] Seq=239 Ack=399 Win=65024 Len=0 TSval=2425170041 TSecr=100527211
   19   0.009340   server → client   HTTP2 PING[0]
   20   0.009448   client → server   TCP 53118 → 50051 [RST] Seq=399 Win=0 Len=0
   21   0.010295   server → client   TCP 50051 → 53118 [FIN, ACK] Seq=256 Ack=400 Win=65024 Len=0 TSval=2425170042 TSecr=100527212
   22   0.010330   client → server   TCP 53118 → 50051 [RST] Seq=400 Win=0 Len=0
```
