### ISSUE TITLE
Can we drop less requests when grpc server restarts?

### ISSUE THREAD

**Issue by yancl** [grpc/grpc#5645]
Hi,
  I have one client that make gRPC requests in a loop and between the loops there is a 60 seconds sleep.But between the two different requests, I **restart** the grpc server, and the client report a `GRPC::BadStatus(14)` which means "No Server Available". 

Well, my expected result is that the second request should **success** after server restarts. 
Since each request was first put into the sending queue and then sent by the I/O thread. The I/O thread can identify each message by its **boundary**.

  So should gRPC send the **pending** new request with **new** connection after receive **FIN** and send **half-sent** request with the **old** connection(use half-closed socket[P.])?

following are tcp dumps:

```
###First Request
22:17:38.544321 IP 172.31.13.163.37141 > 172.31.6.216.50055: Flags [S], seq 2415533685, win 26883, options [mss 8961,sackOK,TS val 390104837 ecr 0,nop,wscale 8], length 0
22:17:38.544481 IP 172.31.6.216.50055 > 172.31.13.163.37141: Flags [S.], seq 1833264624, ack 2415533686, win 28960, options [mss 1460,sackOK,TS val 31579308 ecr 390104837,nop,wscale 7], length 0
22:17:38.544499 IP 172.31.13.163.37141 > 172.31.6.216.50055: Flags [.], ack 1, win 106, options [nop,nop,TS val 390104837 ecr 31579308], length 0
22:17:38.544630 IP 172.31.13.163.37141 > 172.31.6.216.50055: Flags [P.], seq 1:65, ack 1, win 106, options [nop,nop,TS val 390104837 ecr 31579308], length 64
22:17:38.544710 IP 172.31.13.163.37141 > 172.31.6.216.50055: Flags [P.], seq 65:192, ack 1, win 106, options [nop,nop,TS val 390104837 ecr 31579308], length 127
22:17:38.544724 IP 172.31.13.163.37141 > 172.31.6.216.50055: Flags [P.], seq 192:304, ack 1, win 106, options [nop,nop,TS val 390104837 ecr 31579308], length 112
22:17:38.544735 IP 172.31.13.163.37141 > 172.31.6.216.50055: Flags [P.], seq 304:372, ack 1, win 106, options [nop,nop,TS val 390104837 ecr 31579308], length 68
22:17:38.544768 IP 172.31.6.216.50055 > 172.31.13.163.37141: Flags [.], ack 65, win 227, options [nop,nop,TS val 31579308 ecr 390104837], length 0
22:17:38.544873 IP 172.31.6.216.50055 > 172.31.13.163.37141: Flags [.], ack 192, win 227, options [nop,nop,TS val 31579308 ecr 390104837], length 0
22:17:38.544893 IP 172.31.6.216.50055 > 172.31.13.163.37141: Flags [.], ack 304, win 227, options [nop,nop,TS val 31579308 ecr 390104837], length 0
22:17:38.544897 IP 172.31.6.216.50055 > 172.31.13.163.37141: Flags [.], ack 372, win 227, options [nop,nop,TS val 31579308 ecr 390104837], length 0
22:17:38.544932 IP 172.31.6.216.50055 > 172.31.13.163.37141: Flags [P.], seq 1:16, ack 372, win 227, options [nop,nop,TS val 31579308 ecr 390104837], length 15
22:17:38.544937 IP 172.31.13.163.37141 > 172.31.6.216.50055: Flags [.], ack 16, win 106, options [nop,nop,TS val 390104837 ecr 31579308], length 0
22:17:38.544977 IP 172.31.6.216.50055 > 172.31.13.163.37141: Flags [P.], seq 16:29, ack 372, win 227, options [nop,nop,TS val 31579308 ecr 390104837], length 13
22:17:38.544982 IP 172.31.13.163.37141 > 172.31.6.216.50055: Flags [.], ack 29, win 106, options [nop,nop,TS val 390104837 ecr 31579308], length 0
22:17:38.545166 IP 172.31.13.163.37141 > 172.31.6.216.50055: Flags [P.], seq 372:412, ack 29, win 106, options [nop,nop,TS val 390104837 ecr 31579308], length 40
22:17:38.545216 IP 172.31.13.163.37141 > 172.31.6.216.50055: Flags [P.], seq 412:421, ack 29, win 106, options [nop,nop,TS val 390104838 ecr 31579308], length 9
22:17:38.545240 IP 172.31.6.216.50055 > 172.31.13.163.37141: Flags [P.], seq 29:38, ack 372, win 227, options [nop,nop,TS val 31579308 ecr 390104837], length 9
22:17:38.545248 IP 172.31.13.163.37141 > 172.31.6.216.50055: Flags [P.], seq 421:434, ack 38, win 106, options [nop,nop,TS val 390104838 ecr 31579308], length 13
22:17:38.545291 IP 172.31.13.163.37141 > 172.31.6.216.50055: Flags [P.], seq 434:443, ack 38, win 106, options [nop,nop,TS val 390104838 ecr 31579308], length 9
22:17:38.545734 IP 172.31.6.216.50055 > 172.31.13.163.37141: Flags [P.], seq 38:51, ack 443, win 227, options [nop,nop,TS val 31579308 ecr 390104837], length 13
22:17:38.548655 IP 172.31.6.216.50055 > 172.31.13.163.37141: Flags [P.], seq 51:172, ack 443, win 227, options [nop,nop,TS val 31579309 ecr 390104837], length 121
22:17:38.548661 IP 172.31.6.216.50055 > 172.31.13.163.37141: Flags [P.], seq 172:189, ack 443, win 227, options [nop,nop,TS val 31579309 ecr 390104837], length 17
22:17:38.548672 IP 172.31.13.163.37141 > 172.31.6.216.50055: Flags [.], ack 189, win 106, options [nop,nop,TS val 390104838 ecr 31579308], length 0
22:17:38.548899 IP 172.31.6.216.50055 > 172.31.13.163.37141: Flags [P.], seq 189:209, ack 443, win 227, options [nop,nop,TS val 31579309 ecr 390104838], length 20
22:17:38.549614 IP 172.31.6.216.50055 > 172.31.13.163.37141: Flags [P.], seq 209:248, ack 443, win 227, options [nop,nop,TS val 31579309 ecr 390104838], length 39
22:17:38.549634 IP 172.31.13.163.37141 > 172.31.6.216.50055: Flags [.], ack 248, win 106, options [nop,nop,TS val 390104839 ecr 31579309], length 0


###Restart Server
22:17:57.082870 IP 172.31.6.216.50055 > 172.31.13.163.37141: Flags [F.], seq 248, ack 443, win 227, options [nop,nop,TS val 31583943 ecr 390104839], length 0
22:17:57.082889 IP 172.31.6.216.50055 > 172.31.13.163.36851: Flags [F.], seq 1158597662, ack 3240312846, win 227, options [nop,nop,TS val 31583943 ecr 389543385], length 0
22:17:57.121185 IP 172.31.13.163.37141 > 172.31.6.216.50055: Flags [.], ack 249, win 106, options [nop,nop,TS val 390109482 ecr 31583943], length 0
22:17:57.121192 IP 172.31.13.163.36851 > 172.31.6.216.50055: Flags [.], ack 1, win 150, options [nop,nop,TS val 390109482 ecr 31583943], length 0


####Second Request(Use new connection? Since we have received FIN)
22:18:38.550077 IP 172.31.13.163.37141 > 172.31.6.216.50055: Flags [P.], seq 443:462, ack 249, win 106, options [nop,nop,TS val 390119839 ecr 31583943], length 19
22:18:38.550150 IP 172.31.13.163.37141 > 172.31.6.216.50055: Flags [P.], seq 462:502, ack 249, win 106, options [nop,nop,TS val 390119839 ecr 31583943], length 40
22:18:38.550177 IP 172.31.13.163.37141 > 172.31.6.216.50055: Flags [P.], seq 502:511, ack 249, win 106, options [nop,nop,TS val 390119839 ecr 31583943], length 9
22:18:38.550201 IP 172.31.13.163.37141 > 172.31.6.216.50055: Flags [P.], seq 511:524, ack 249, win 106, options [nop,nop,TS val 390119839 ecr 31583943], length 13
22:18:38.550261 IP 172.31.6.216.50055 > 172.31.13.163.37141: Flags [R], seq 1833264873, win 0, length 0
22:18:38.550273 IP 172.31.6.216.50055 > 172.31.13.163.37141: Flags [R], seq 1833264873, win 0, length 0
22:18:38.550329 IP 172.31.6.216.50055 > 172.31.13.163.37141: Flags [R], seq 1833264873, win 0, length 0
22:18:38.550333 IP 172.31.6.216.50055 > 172.31.13.163.37141: Flags [R], seq 1833264873, win 0, length 0

###Third Request(New connection)
22:18:38.550633 IP 172.31.13.163.37149 > 172.31.6.216.50055: Flags [S], seq 3234987938, win 26883, options [mss 8961,sackOK,TS val 390119839 ecr 0,nop,wscale 8], length 0
22:18:38.550780 IP 172.31.6.216.50055 > 172.31.13.163.37149: Flags [S.], seq 359999844, ack 3234987939, win 28960, options [mss 1460,sackOK,TS val 31594310 ecr 390119839,nop,wscale 7], length 0
22:18:38.550797 IP 172.31.13.163.37149 > 172.31.6.216.50055: Flags [.], ack 1, win 106, options [nop,nop,TS val 390119839 ecr 31594310], length 0
22:18:38.550841 IP 172.31.13.163.37149 > 172.31.6.216.50055: Flags [P.], seq 1:65, ack 1, win 106, options [nop,nop,TS val 390119839 ecr 31594310], length 64
22:18:38.550873 IP 172.31.13.163.37149 > 172.31.6.216.50055: Flags [P.], seq 65:192, ack 1, win 106, options [nop,nop,TS val 390119839 ecr 31594310], length 127
22:18:38.550886 IP 172.31.13.163.37149 > 172.31.6.216.50055: Flags [P.], seq 192:304, ack 1, win 106, options [nop,nop,TS val 390119839 ecr 31594310], length 112
22:18:38.550896 IP 172.31.13.163.37149 > 172.31.6.216.50055: Flags [P.], seq 304:372, ack 1, win 106, options [nop,nop,TS val 390119839 ecr 31594310], length 68
22:18:38.550936 IP 172.31.13.163.37149 > 172.31.6.216.50055: Flags [P.], seq 372:412, ack 1, win 106, options [nop,nop,TS val 390119839 ecr 31594310], length 40
22:18:38.550961 IP 172.31.13.163.37149 > 172.31.6.216.50055: Flags [P.], seq 412:421, ack 1, win 106, options [nop,nop,TS val 390119839 ecr 31594310], length 9
22:18:38.550969 IP 172.31.6.216.50055 > 172.31.13.163.37149: Flags [.], ack 65, win 227, options [nop,nop,TS val 31594310 ecr 390119839], length 0
22:18:38.550983 IP 172.31.13.163.37149 > 172.31.6.216.50055: Flags [P.], seq 421:434, ack 1, win 106, options [nop,nop,TS val 390119839 ecr 31594310], length 13
22:18:38.550988 IP 172.31.6.216.50055 > 172.31.13.163.37149: Flags [.], ack 192, win 227, options [nop,nop,TS val 31594310 ecr 390119839], length 0
22:18:38.551023 IP 172.31.6.216.50055 > 172.31.13.163.37149: Flags [.], ack 304, win 227, options [nop,nop,TS val 31594310 ecr 390119839], length 0
22:18:38.551028 IP 172.31.6.216.50055 > 172.31.13.163.37149: Flags [.], ack 372, win 227, options [nop,nop,TS val 31594310 ecr 390119839], length 0
22:18:38.551056 IP 172.31.6.216.50055 > 172.31.13.163.37149: Flags [.], ack 412, win 227, options [nop,nop,TS val 31594310 ecr 390119839], length 0
22:18:38.551070 IP 172.31.6.216.50055 > 172.31.13.163.37149: Flags [.], ack 421, win 227, options [nop,nop,TS val 31594310 ecr 390119839], length 0
22:18:38.551090 IP 172.31.6.216.50055 > 172.31.13.163.37149: Flags [.], ack 434, win 227, options [nop,nop,TS val 31594310 ecr 390119839], length 0
22:18:38.551254 IP 172.31.6.216.50055 > 172.31.13.163.37149: Flags [P.], seq 1:16, ack 434, win 227, options [nop,nop,TS val 31594310 ecr 390119839], length 15
22:18:38.551259 IP 172.31.13.163.37149 > 172.31.6.216.50055: Flags [.], ack 16, win 106, options [nop,nop,TS val 390119839 ecr 31594310], length 0
22:18:38.551288 IP 172.31.13.163.37149 > 172.31.6.216.50055: Flags [P.], seq 434:443, ack 16, win 106, options [nop,nop,TS val 390119839 ecr 31594310], length 9
22:18:38.551310 IP 172.31.6.216.50055 > 172.31.13.163.37149: Flags [P.], seq 16:29, ack 434, win 227, options [nop,nop,TS val 31594310 ecr 390119839], length 13
22:18:38.551567 IP 172.31.6.216.50055 > 172.31.13.163.37149: Flags [P.], seq 29:38, ack 443, win 227, options [nop,nop,TS val 31594310 ecr 390119839], length 9
22:18:38.551586 IP 172.31.13.163.37149 > 172.31.6.216.50055: Flags [.], ack 38, win 106, options [nop,nop,TS val 390119839 ecr 31594310], length 0
22:18:38.556961 IP 172.31.6.216.50055 > 172.31.13.163.37149: Flags [P.], seq 38:159, ack 443, win 227, options [nop,nop,TS val 31594311 ecr 390119839], length 121
22:18:38.556968 IP 172.31.6.216.50055 > 172.31.13.163.37149: Flags [P.], seq 159:176, ack 443, win 227, options [nop,nop,TS val 31594311 ecr 390119839], length 17
22:18:38.556982 IP 172.31.13.163.37149 > 172.31.6.216.50055: Flags [.], ack 176, win 106, options [nop,nop,TS val 390119840 ecr 31594311], length 0
22:18:38.557219 IP 172.31.6.216.50055 > 172.31.13.163.37149: Flags [P.], seq 176:196, ack 443, win 227, options [nop,nop,TS val 31594311 ecr 390119840], length 20
22:18:38.557777 IP 172.31.6.216.50055 > 172.31.13.163.37149: Flags [P.], seq 196:235, ack 443, win 227, options [nop,nop,TS val 31594311 ecr 390119840], length 39
22:18:38.557797 IP 172.31.13.163.37149 > 172.31.6.216.50055: Flags [.], ack 235, win 106, options [nop,nop,TS val 390119841 ecr 31594311], length 0


###Fourth Request
22:19:38.558203 IP 172.31.13.163.37149 > 172.31.6.216.50055: Flags [P.], seq 443:462, ack 235, win 106, options [nop,nop,TS val 390134841 ecr 31594311], length 19
22:19:38.558272 IP 172.31.13.163.37149 > 172.31.6.216.50055: Flags [P.], seq 462:502, ack 235, win 106, options [nop,nop,TS val 390134841 ecr 31594311], length 40
22:19:38.558299 IP 172.31.13.163.37149 > 172.31.6.216.50055: Flags [P.], seq 502:511, ack 235, win 106, options [nop,nop,TS val 390134841 ecr 31594311], length 9
22:19:38.558324 IP 172.31.13.163.37149 > 172.31.6.216.50055: Flags [P.], seq 511:524, ack 235, win 106, options [nop,nop,TS val 390134841 ecr 31594311], length 13
22:19:38.558645 IP 172.31.6.216.50055 > 172.31.13.163.37149: Flags [.], ack 524, win 227, options [nop,nop,TS val 31609312 ecr 390134841], length 0
22:19:38.562288 IP 172.31.6.216.50055 > 172.31.13.163.37149: Flags [P.], seq 235:249, ack 524, win 227, options [nop,nop,TS val 31609312 ecr 390134841], length 14
22:19:38.562552 IP 172.31.6.216.50055 > 172.31.13.163.37149: Flags [P.], seq 249:269, ack 524, win 227, options [nop,nop,TS val 31609313 ecr 390134841], length 20
22:19:38.562572 IP 172.31.13.163.37149 > 172.31.6.216.50055: Flags [.], ack 269, win 106, options [nop,nop,TS val 390134842 ecr 31609312], length 0
22:19:38.563112 IP 172.31.6.216.50055 > 172.31.13.163.37149: Flags [P.], seq 269:280, ack 524, win 227, options [nop,nop,TS val 31609313 ecr 390134842], length 11
22:19:38.601179 IP 172.31.13.163.37149 > 172.31.6.216.50055: Flags [.], ack 280, win 106, options [nop,nop,TS val 390134852 ecr 31609313], length 0
22:20:07.570250 IP 172.31.13.163.37149 > 172.31.6.216.50055: Flags [F.], seq 524, ack 280, win 106, options [nop,nop,TS val 390142094 ecr 31609313], length 0
22:20:07.570618 IP 172.31.6.216.50055 > 172.31.13.163.37149: Flags [F.], seq 280, ack 525, win 227, options [nop,nop,TS val 31616565 ecr 390142094], length 0
22:20:07.570633 IP 172.31.13.163.37149 > 172.31.6.216.50055: Flags [.], ack 281, win 106, options [nop,nop,TS val 390142094 ecr 31616565], length 0
```

and  the responses from client:

```
========= 0 REQUEST ========
Start Time: 2016-03-08 22:17:38 +0800
End Time: 2016-03-08 22:18:38 +0800
========= 1 REQUEST ========
Start Time: 2016-03-08 22:18:38 +0800
NORMAL GRPC::BadStatus
14:
========= 2 REQUEST ========
Start Time: 2016-03-08 22:18:38 +0800
End Time: 2016-03-08 22:19:38 +0800
```

Thanks:)

**Comment by hcaseyal** [comment]
Talked to @ncteisen and he said this was a bug

**Comment by ncteisen** [comment]
It is a well known issue with core that the first request made after restarting a server will fail. This is because when the client isn't sending requests it isn't polling, and thus will not be able notice that the connection is broken.

This can be mitigated with `GRPC_CLIENT_CHANNEL_BACKUP_POLL_INTERVAL_MS`. See https://github.com/grpc/grpc/blob/master/doc/environment_variables.md for more details on that
