### ISSUE TITLE
SRV is resolved but LB policy `received update with 0 addresses`

### ISSUE THREAD

**Issue by arkadijs** [grpc/grpc#28595]
### What version of gRPC and what language are you using?

gRPC 1.43.0 via `grpcio` Python library.

### What operating system (Linux, Windows,...) and version?

Arch Linux and macOS 12.1 on client; Linux on server.

### What runtime / compiler are you using (e.g. python version or version of gcc)

Python 3.10.1.

### What did you do?

The client is basically:
```python
import grpc
from grpc_health.v1 import health_pb2, health_pb2_grpc

host = "service.ecs.local"
# host = "780f147a40c54053bbb177e0c53c848f.service.ecs.local"
port = "49191"

channel = grpc.insecure_channel(f'dns:///{host}:{port}',
    options=[('grpc.dns_enable_srv_queries', 1), # SRV _grpclb._tcp.<host> will be looked up first
            ('grpc.lb_policy_name', 'pick_first'),
        #   ('grpc.lb_policy_name', 'round_robin'),
    ])
health_check_stub = health_pb2_grpc.HealthStub(channel)
# grpc.channel_ready_future(channel).result()
reply = health_check_stub.Check(health_pb2.HealthCheckRequest(service='grpc_service'))
print(reply.status == health_pb2.HealthCheckResponse.SERVING)
```

### What did you expect to see?

> True

### What did you see instead?

`True` if `host = 780f147a40c54053bbb177e0c53c848f.service.ecs.local` which is `IN A 10.0.0.250` record and the correct port `49191` is provided.

Otherwise, an exception is output:
```
grpc._channel._InactiveRpcError: <_InactiveRpcError of RPC that terminated with:
    status = StatusCode.UNAVAILABLE
    details = "Empty update"
    debug_error_string = "{"created":"@1642461360.818380164","description":"Failed to pick subchannel",
        "file":"src/core/ext/filters/client_channel/client_channel.cc","file_line":3134,
        "referenced_errors":[{"created":"@1642461360.818375844",
        "description":"Empty update","file":"src/core/lib/transport/error_utils.cc",
        "file_line":163,"grpc_status":14}]}"
```
... if `host = service.ecs.local` which is an `SRV` record, the `port` is irrelevant. `service.ecs.local` is:

```
_grpclb._tcp.service.ecs.local. 10 IN SRV 1 1 49191 780f147a40c54053bbb177e0c53c848f._grpclb._tcp.service.ecs.local.
780f147a40c54053bbb177e0c53c848f._grpclb._tcp.service.ecs.local. 10 IN A 10.0.0.250
```

It just never connects after DNS resolution is completed - according to the `tcpdump`.

Good run:
```
00:25:27.408526 IP 10.50.1.34.33793 > 10.20.0.2.53: 10118+ AAAA? 780f147a40c54053bbb177e0c53c848f.service.ecs.local. (78)
00:25:27.408567 IP 10.50.1.34.33793 > 10.20.0.2.53: 32141+ A? 780f147a40c54053bbb177e0c53c848f.service.ecs.local. (78)
00:25:27.408587 IP 10.50.1.34.33793 > 10.20.0.2.53: 64566+ SRV? _grpclb._tcp.780f147a40c54053bbb177e0c53c848f.service.ecs.local. (91)
00:25:27.437352 IP 10.20.0.2.53 > 10.50.1.34.33793: 10118 0/1/0 (165)
00:25:27.437455 IP 10.20.0.2.53 > 10.50.1.34.33793: 64566 NXDomain 0/1/0 (178)
00:25:27.437568 IP 10.50.1.34.33793 > 10.20.0.2.53: 35772+ AAAA? 780f147a40c54053bbb177e0c53c848f.service.ecs.local.apollo.lv. (88)
00:25:27.437818 IP 10.20.0.2.53 > 10.50.1.34.33793: 32141 1/0/0 A 10.0.0.250 (94)
00:25:27.496433 IP 10.20.0.2.53 > 10.50.1.34.33793: 35772 NXDomain 0/1/0 (138)
00:25:27.497121 IP 10.50.1.34.40552 > 10.0.0.250.49191: Flags [S], seq 3092372945, win 64240, options [mss 1460,sackOK,TS val 4022690744 ecr 0,nop,wscale 7], length 0
00:25:27.528220 IP 10.0.0.250.49191 > 10.50.1.34.40552: Flags [S.], seq 3751571807, ack 3092372946, win 28960, options [mss 1286,sackOK,TS val 2774702107 ecr 4022690744,nop,wscale 7], length 0
00:25:27.528303 IP 10.50.1.34.40552 > 10.0.0.250.49191: Flags [.], ack 1, win 502, options [nop,nop,TS val 4022690776 ecr 2774702107], length 0
00:25:27.528743 IP 10.50.1.34.40552 > 10.0.0.250.49191: Flags [P.], seq 1:83, ack 1, win 502, options [nop,nop,TS val 4022690776 ecr 2774702107], length 82
00:25:27.559077 IP 10.0.0.250.49191 > 10.50.1.34.40552: Flags [.], ack 83, win 227, options [nop,nop,TS val 2774702137 ecr 4022690776], length 0
00:25:27.559164 IP 10.0.0.250.49191 > 10.50.1.34.40552: Flags [P.], seq 1:47, ack 83, win 227, options [nop,nop,TS val 2774702138 ecr 4022690776], length 46
00:25:27.559200 IP 10.50.1.34.40552 > 10.0.0.250.49191: Flags [.], ack 47, win 502, options [nop,nop,TS val 4022690806 ecr 2774702138], length 0
00:25:27.561939 IP 10.50.1.34.40552 > 10.0.0.250.49191: Flags [P.], seq 83:452, ack 47, win 502, options [nop,nop,TS val 4022690809 ecr 2774702138], length 369
00:25:27.589543 IP 10.0.0.250.49191 > 10.50.1.34.40552: Flags [P.], seq 47:242, ack 452, win 235, options [nop,nop,TS val 2774702168 ecr 4022690809], length 195
00:25:27.589617 IP 10.50.1.34.40552 > 10.0.0.250.49191: Flags [.], ack 242, win 501, options [nop,nop,TS val 4022690837 ecr 2774702168], length 0
00:25:27.589848 IP 10.50.1.34.40552 > 10.0.0.250.49191: Flags [P.], seq 452:499, ack 242, win 501, options [nop,nop,TS val 4022690837 ecr 2774702168], length 47
00:25:27.620345 IP 10.0.0.250.49191 > 10.50.1.34.40552: Flags [P.], seq 242:259, ack 499, win 235, options [nop,nop,TS val 2774702199 ecr 4022690837], length 17
00:25:27.620399 IP 10.50.1.34.40552 > 10.0.0.250.49191: Flags [.], ack 259, win 501, options [nop,nop,TS val 4022690868 ecr 2774702199], length 0
00:25:27.645790 IP 10.50.1.34.40552 > 10.0.0.250.49191: Flags [F.], seq 499, ack 259, win 501, options [nop,nop,TS val 4022690893 ecr 2774702199], length 0
00:25:27.677059 IP 10.0.0.250.49191 > 10.50.1.34.40552: Flags [F.], seq 259, ack 500, win 235, options [nop,nop,TS val 2774702255 ecr 4022690893], length 0
00:25:27.677119 IP 10.50.1.34.40552 > 10.0.0.250.49191: Flags [.], ack 260, win 501, options [nop,nop,TS val 4022690924 ecr 2774702255], length 0
```

Bad run:
```
00:21:55.652826 IP 10.50.1.34.47880 > 10.20.0.2.53: 10118+ AAAA? service.ecs.local. (45)
00:21:55.652866 IP 10.50.1.34.47880 > 10.20.0.2.53: 32141+ A? service.ecs.local. (45)
00:21:55.652889 IP 10.50.1.34.47880 > 10.20.0.2.53: 64566+ SRV? _grpclb._tcp.service.ecs.local. (58)
00:21:55.681365 IP 10.20.0.2.53 > 10.50.1.34.47880: 10118 0/0/0 (45)
00:21:55.681457 IP 10.20.0.2.53 > 10.50.1.34.47880: 32141 0/0/0 (45)
00:21:55.681597 IP 10.50.1.34.47880 > 10.20.0.2.53: 35772+ AAAA? service.ecs.local.apollo.lv. (55)
00:21:55.681652 IP 10.50.1.34.47880 > 10.20.0.2.53: 50317+ A? service.ecs.local.apollo.lv. (55)
00:21:55.682310 IP 10.20.0.2.53 > 10.50.1.34.47880: 64566 1/0/0 SRV 780f147a40c54053bbb177e0c53c848f._grpclb._tcp.service.ecs.local.:49191 1 1 (151)
00:21:55.682478 IP 10.50.1.34.47880 > 10.20.0.2.53: 50250+ AAAA? 780f147a40c54053bbb177e0c53c848f._grpclb._tcp.service.ecs.local. (91)
00:21:55.682522 IP 10.50.1.34.47880 > 10.20.0.2.53: 25412+ A? 780f147a40c54053bbb177e0c53c848f._grpclb._tcp.service.ecs.local. (91)
00:21:55.712869 IP 10.20.0.2.53 > 10.50.1.34.47880: 35772 NXDomain 0/0/0 (55)
00:21:55.712953 IP 10.20.0.2.53 > 10.50.1.34.47880: 50317 NXDomain 0/0/0 (55)
00:21:55.713021 IP 10.20.0.2.53 > 10.50.1.34.47880: 50250 0/0/0 (91)
00:21:55.713284 IP 10.50.1.34.47880 > 10.20.0.2.53: 12261+ AAAA? 780f147a40c54053bbb177e0c53c848f._grpclb._tcp.service.ecs.local.apollo.lv. (101)
00:21:55.714846 IP 10.20.0.2.53 > 10.50.1.34.47880: 25412 1/0/0 A 10.0.0.250 (107)
00:21:55.742877 IP 10.20.0.2.53 > 10.50.1.34.47880: 12261 NXDomain 0/0/0 (101)
```

Setting `GRPC_TRACE` reveals following:

Good run:
```
I0118 01:12:33.785716388   17194 grpc_ares_wrapper.cc:540]   (c-ares resolver) request:0x7fb018001090 c-ares address sorting: input[0]=10.0.0.250:49191
I0118 01:12:33.785834850   17194 grpc_ares_wrapper.cc:540]   (c-ares resolver) request:0x7fb018001090 c-ares address sorting: output[0]=10.0.0.250:49191
I0118 01:12:33.785926181   17194 pick_first.cc:144]          Pick First 0x7fb0180019e0 created.
I0118 01:12:33.786191341   17194 pick_first.cc:261]          Pick First 0x7fb0180019e0 received update with 1 addresses
I0118 01:12:33.786231936   17194 subchannel_list.h:363]      [pick_first 0x7fb0180019e0] Creating subchannel list 0x7fb018001d80 for 1 subchannels
```

Bad run:
```
I0118 01:27:44.441517612   17243 grpc_ares_wrapper.cc:540]   (c-ares resolver) request:0x55e7033ac960 c-ares address sorting: input[0]=10.0.0.250:49191
I0118 01:27:44.441614019   17243 grpc_ares_wrapper.cc:540]   (c-ares resolver) request:0x55e7033ac960 c-ares address sorting: output[0]=10.0.0.250:49191
I0118 01:27:44.441682610   17243 pick_first.cc:144]          Pick First 0x55e7032652d0 created.
I0118 01:27:44.441729685   17243 pick_first.cc:261]          Pick First 0x55e7032652d0 received update with 0 addresses
I0118 01:27:44.441763117   17243 subchannel_list.h:363]      [pick_first 0x55e7032652d0] Creating subchannel list 0x55e70328c760 for 0 subchannels
```

I can attach full dumps if needed. Happens both with `pick_first` and `round_robin`.

### Anything else we should know about your project / environment?

AWS ECS environment, thus SRV records and random ports.

**Comment by yashykt** [comment]
@apolcyn @markdroth PTAL

**Comment by markdroth** [comment]
gRPC uses SRV records only when using the `grpclb` LB policy.  For reference, see:
- [gRFC A5: Load Balancing and DNS](https://github.com/grpc/proposal/blob/master/A5-grpclb-in-dns.md)
- [gRFC A24: Load Balancing Policy Configuration](https://github.com/grpc/proposal/blob/master/A24-lb-policy-config.md)
- [gRFC A26: gRPCLB Selection](https://github.com/grpc/proposal/blob/master/A26-grpclb-selection.md)

So the configuration you're using here is not expected to work.  If you're using any LB policy other than `grpclb`, the SRV records are not used, so enabling the `grpc.dns_enable_srv_queries` channel arg doesn't actually accomplish anything -- it will cause the SRV records to be looked up, but the LB policy won't actually use the resulting data.

**Comment by arkadijs** [comment]
Would you consider a PR that adds SRV records functionality to `pick_first` and `round_robin` without legacy of `grpclb`?

My use case is to talk to _true_ gRPC peers (implementations) on unpredictable ports directly. No proxy-style load-balancer.

> gRPC only uses SRV records for grpclb, as described in this gRFC.  It does not use them for backend addresses, and we have no plans to change that.  If you want to implement your own system for service discovery on top of DNS, you can write your own resolver plugin for gRPC.

... unfortunately, [no Python support](https://github.com/grpc/grpc/issues/11685) for that?

> will cause the SRV records to be looked up, but the LB policy won't actually use the resulting data.

Perhaps a clearly unusable combination of options could be diagnosed with a better error?

**Comment by arkadijs** [comment]
Also, I tried `grpclb` and it doesn't work due to expecting `/grpc.lb.v1.LoadBalancer/BalanceLoad` on the endpoint, obviously.

**Comment by markdroth** [comment]
> Would you consider a PR that adds SRV records functionality to `pick_first` and `round_robin` without legacy of `grpclb`?

I don't think that would be the right way to do this.  The problem isn't in the LB policies; they are already using the list of backend addresses returned by the resolver, which is exactly what they're supposed to be doing.  The problem is that the only purpose of the SRV-processing code in the DNS resolver is to support `grpclb` balancer addresses, so the DNS resolver does not return those addresses in the main backend address list; instead, it returns them via a special attribute used to indicate a list of balancer addresses for the `grpclb` policy to talk to, and the only LB policy that uses (or should use) that attribute is the `grpclb` policy.  Instead of changing every single other LB policy to look at the special attribute that contains the `grpclb` balancer addresses and treat those as backend addresses, I think the right answer is to write a custom resolver plugin that returns those addresses in the main list of backend addresses, exactly as per the quote you cited from the gRFC.  That way, it will work with any LB policy.

> ... unfortunately, [no Python support](https://github.com/grpc/grpc/issues/11685) for that?

That's correct, and the issue you linked to is the right one to follow for that functionality.

> Perhaps a clearly unusable combination of options could be diagnosed with a better error?

I do plan to do some work in the near future to improve the status messages, as per #22883.  The idea is that in this kind of situation, the status message would say something like "DNS resolver for service.ecs.local returned no addresses" instead of just "empty update".  That isn't going to say anything about the SRV records, since that's ultimately not the relevant point, but it will at least point you to the right component to see why your assumption was incorrect.

One other thing we can do is to improve any misleading documentation that might have steered you in the wrong direction.  Can you tell me where you learned about the `grpc.dns_enable_srv_queries` channel arg?  That's basically supposed to be used only with the `grpclb` LB policy, so any documentation that doesn't make that clear should be updated.

**Comment by markdroth** [comment]
> Also, I tried `grpclb` and it doesn't work due to expecting `/grpc.lb.v1.LoadBalancer/BalanceLoad` on the endpoint, obviously.

Yeah, I would not have expected that to work.  The `grpclb` policy is expecting the SRV records to point to the balancers it needs to talk to, not to the backend servers directly.

**Comment by arkadijs** [comment]
I haven't been able to find applied or reference documentation on using SRV records. Only [high-level overview](https://grpc.io/blog/grpc-load-balancing/), [another](https://majidfn.com/blog/grpc-load-balancing/), and [Readme](https://github.com/grpc/grpc/blob/master/doc/load-balancing.md). So I looked on random posts via Google, then into [header file](https://github.com/grpc/grpc/blob/v1.42.x/include/grpc/impl/codegen/grpc_types.h) and gRPC C++ source to learn about `_grpclb._tcp`.

My work is constrained by SRV records (non-fixed ports) and legacy Python app, so it is very unfortunate I cannot proceed. Given how common SRV pattern is -- ok, might be niche now, but that's what AWS ECS service discovery gives us. Not yet on Kubernetes for this critical part of the infra.

Looking on gRPC as a black box, it seems like low-hanging fruit to just "screw this" and implement alternative path for SRV for non-grpclb policies by just sending them host:port list. So the API between resolver and policies is plain list, where `grpclb` reformat them to what is required. I've read the related tickets and they are dragged on for years... 

For the context, I'm experimenting with getting rid of proxy LB put in by prior engineers. It caused us several production outages. Ultimately, we don't need the (buggy) middle man; the nature of application allows that and we're in full control of gRPC client and server.
